author,id,created_utc,permalink,body,score,subreddit
Doogy44,kwbzkjt,2024-03-24 20:53:12,/r/ETFs/comments/1bmbtcl/what_is_a_correct_time_in_a_week_to_put_500_in_voo/kwbzkjt/,"As soon as possible … about half the time when you buy stocks they go down at first, but then go up … no good way to predict it …",2,ETFs
Character_Double_394,kwccttl,2024-03-24 22:30:54,/r/ETFs/comments/1bmbtcl/what_is_a_correct_time_in_a_week_to_put_500_in_voo/kwccttl/,"my magic 8 ball says. ""ask again tomorrow""🤔",2,ETFs
ZealousidealTune9481,kwbh1d5,2024-03-24 17:35:23,/r/ETFs/comments/1bmbtcl/what_is_a_correct_time_in_a_week_to_put_500_in_voo/kwbh1d5/,"Time in the market > timing the market. Also, watch it for 1 week daily. Put an alert for when the stock hits a number you'd be comfortable executing the sale at.",3,ETFs
Solid_Illustrator640,kwaxhak,2024-03-24 13:32:26,/r/ETFs/comments/1bmbtcl/what_is_a_correct_time_in_a_week_to_put_500_in_voo/kwaxhak/,Now.,2,ETFs
shit-at-work69,kwb3lq3,2024-03-24 14:41:42,/r/ETFs/comments/1bmbtcl/what_is_a_correct_time_in_a_week_to_put_500_in_voo/kwb3lq3/,Today,1,ETFs
Scipio555,kwb9x9s,2024-03-24 16:01:45,/r/ETFs/comments/1bmbtcl/what_is_a_correct_time_in_a_week_to_put_500_in_voo/kwb9x9s/,If there was a “good time” then you bet everyone would have invest in the same time. Just pick a date and automate your investing.,1,ETFs
bigtime284,kwbi06x,2024-03-24 17:47:44,/r/ETFs/comments/1bmbtcl/what_is_a_correct_time_in_a_week_to_put_500_in_voo/kwbi06x/,My crystal ball says…..Tuesday or Wednesday lolol,1,ETFs
brew_radicals,kwbiee8,2024-03-24 17:52:39,/r/ETFs/comments/1bmbtcl/what_is_a_correct_time_in_a_week_to_put_500_in_voo/kwbiee8/,In this volatile and/or irrational market it’s not worth trying to time your investments to days/times of day. Even trying to time for economic data will screw you.,1,ETFs
LuxanHD,kwbm7qu,2024-03-24 18:39:39,/r/ETFs/comments/1bmbtcl/what_is_a_correct_time_in_a_week_to_put_500_in_voo/kwbm7qu/,Yes,1,ETFs
whirlpo0l,kwboqlc,2024-03-24 19:08:59,/r/ETFs/comments/1bmbtcl/what_is_a_correct_time_in_a_week_to_put_500_in_voo/kwboqlc/,Get your money in the market ASAP jabroni and stop trying to time it.,1,ETFs
LocalAcceptable486,kwbtfrj,2024-03-24 19:58:40,/r/ETFs/comments/1bmbtcl/what_is_a_correct_time_in_a_week_to_put_500_in_voo/kwbtfrj/,Not today... Wait for the market to open Monday morning.,1,ETFs
bambam_mcstanky2,kwbupmu,2024-03-24 20:10:49,/r/ETFs/comments/1bmbtcl/what_is_a_correct_time_in_a_week_to_put_500_in_voo/kwbupmu/,Tuesday’s before 12 noon est. and not on the 15 th or 30 of the month when pension fund contributions hit.  Totally a WAG on my part.  I usually just opt for contributions as soon as I can get them in the market.,1,ETFs
Jms0088,kwbuqcv,2024-03-24 20:11:01,/r/ETFs/comments/1bmbtcl/what_is_a_correct_time_in_a_week_to_put_500_in_voo/kwbuqcv/,Now,1,ETFs
Historical-Reach8587,kwbyr42,2024-03-24 20:46:20,/r/ETFs/comments/1bmbtcl/what_is_a_correct_time_in_a_week_to_put_500_in_voo/kwbyr42/,Anytime.  Stop trying to time the market.  Investing is a long term game.,1,ETFs
Over-Juggernaut-2896,kwbzw0h,2024-03-24 20:55:53,/r/ETFs/comments/1bmbtcl/what_is_a_correct_time_in_a_week_to_put_500_in_voo/kwbzw0h/,Time in the market beats timing the market,1,ETFs
Wokst-r,kwc2xwp,2024-03-24 21:20:24,/r/ETFs/comments/1bmbtcl/what_is_a_correct_time_in_a_week_to_put_500_in_voo/kwc2xwp/,The people are right but it doesn’t go up everyday lol. If you know how to read a chart just wait for a daily pull back then next a daily engulfing of that pullback for a nice entry. The weekly could pull back but it’s harder to tell when a weeks worth of data will pullback so just understand that.,1,ETFs
newtrip99,kwc48jn,2024-03-24 21:30:21,/r/ETFs/comments/1bmbtcl/what_is_a_correct_time_in_a_week_to_put_500_in_voo/kwc48jn/,I don’t think there is a correct time or best time of day. But there is merit to split it up and invest $100 per day over a week.,1,ETFs
bro-v-wade,kwc6uz9,2024-03-24 21:49:49,/r/ETFs/comments/1bmbtcl/what_is_a_correct_time_in_a_week_to_put_500_in_voo/kwc6uz9/,9:30AM the day it hits your checking account.,1,ETFs
vs92s110,kwca8fz,2024-03-24 22:13:26,/r/ETFs/comments/1bmbtcl/what_is_a_correct_time_in_a_week_to_put_500_in_voo/kwca8fz/,Have you tried consulting the Magic 8 ball?,1,ETFs
TheCloseEnemy,kwcgk21,2024-03-24 22:55:08,/r/ETFs/comments/1bmbtcl/what_is_a_correct_time_in_a_week_to_put_500_in_voo/kwcgk21/,Do not I repeat do not try and time the market. EVER. Most of the time VOO is at an all time high. So the best time to buy is right now!,1,ETFs
Gunny_1775,kwcl3tv,2024-03-24 23:23:49,/r/ETFs/comments/1bmbtcl/what_is_a_correct_time_in_a_week_to_put_500_in_voo/kwcl3tv/,"There is no best time, just DCA. I used to listen to a podcast that would imitate which day is the best day to invest into the market and in the end it all boiled down to a dollar here, dollar there and was no exact day that is better.",1,ETFs
apooroldinvestor,kwaxfti,2024-03-24 13:32:02,/r/ETFs/comments/1bmbtcl/what_is_a_correct_time_in_a_week_to_put_500_in_voo/kwaxfti/,$500? .... lol give me a break...,-15,ETFs
Melechesh,kwb0wua,2024-03-24 14:09:37,/r/ETFs/comments/1bmbtcl/what_is_a_correct_time_in_a_week_to_put_500_in_voo/kwb0wua/,"If you have a curved penis, do you have to wait for a crescent moon?",25,ETFs
foldinthechhese,kwbog0d,2024-03-24 19:05:40,/r/ETFs/comments/1bmbtcl/what_is_a_correct_time_in_a_week_to_put_500_in_voo/kwbog0d/,"Thinking with penis has never let me down before. So, this is excellent advice. Here’s to raising your penis and your portfolio.",3,ETFs
kimchi_fried_lice,kwdxrk5,2024-03-25 04:14:20,/r/ETFs/comments/1bmbtcl/what_is_a_correct_time_in_a_week_to_put_500_in_voo/kwdxrk5/,"When the moon hits your cock like a big pizza clock, that’s amore~",2,ETFs
EP009,kwea6rz,2024-03-25 05:29:08,/r/ETFs/comments/1bmbtcl/what_is_a_correct_time_in_a_week_to_put_500_in_voo/kwea6rz/,How does the eclipse affect my dividends? Both penile and stock based.,1,ETFs
StoppingPowah,kwb0h31,2024-03-24 14:04:34,/r/ETFs/comments/1bmbtcl/what_is_a_correct_time_in_a_week_to_put_500_in_voo/kwb0h31/,How do you do regular purchases without settled funds? You’d need to somehow balance out regular deposits and then regular purchases like 2-3 days later,2,ETFs
cutsplitstak,kwbgw8m,2024-03-24 17:33:34,/r/ETFs/comments/1bmbtcl/what_is_a_correct_time_in_a_week_to_put_500_in_voo/kwbgw8m/,Good answer.,1,ETFs
NoGuest124,kwbifxw,2024-03-24 17:53:12,/r/ETFs/comments/1bmbtcl/what_is_a_correct_time_in_a_week_to_put_500_in_voo/kwbifxw/,In that sense you always buy market not limit. Right?,1,ETFs
faxanaduu,kwc7aej,2024-03-24 21:52:51,/r/ETFs/comments/1bmbtcl/what_is_a_correct_time_in_a_week_to_put_500_in_voo/kwc7aej/,"Interesting. Ive always wondered if there was a day where automated purchases were made into peoples 401ks. But im paid twice a month and the purchase date is usually around 13 and 28....few days after my paycheck. 

Was that discussed in that class? A lot of Fridays seem kinda lackluster in either direction, but im just saying that based off observation over the past few months.",1,ETFs
nettek,kwci738,2024-03-24 23:05:32,/r/ETFs/comments/1bmbtcl/what_is_a_correct_time_in_a_week_to_put_500_in_voo/kwci738/,Why do people sell on the weekend?,1,ETFs
sureshot58,kwcxg75,2024-03-25 00:39:21,/r/ETFs/comments/1bmbtcl/what_is_a_correct_time_in_a_week_to_put_500_in_voo/kwcxg75/,"This is always correct.  Unless of course Monday, Thursday , or Friday!",1,ETFs
Newdzlol,kwb4uhv,2024-03-24 14:56:54,/r/ETFs/comments/1bmbtcl/what_is_a_correct_time_in_a_week_to_put_500_in_voo/kwb4uhv/,Everybody needs to start somewhere. He's attempting to make the right decisions in life.,7,ETFs
Sagerosk,kwbb16i,2024-03-24 16:16:03,/r/ETFs/comments/1bmbtcl/what_is_a_correct_time_in_a_week_to_put_500_in_voo/kwbb16i/,"Since that's such an insignificant amount to you, how much will you be contributing to OP?",3,ETFs
ilikepizza2much,kwbh8yl,2024-03-24 17:38:04,/r/ETFs/comments/1bmbtcl/what_is_a_correct_time_in_a_week_to_put_500_in_voo/kwbh8yl/,"You must do your own research, and use a mirror to check what kind of moon is rising",6,ETFs
reggieLedoux26,kwcg5ve,2024-03-24 22:52:36,/r/ETFs/comments/1bmbtcl/what_is_a_correct_time_in_a_week_to_put_500_in_voo/kwcg5ve/,Then you must find the canyon of the crescent moon,1,ETFs
Expelleddux,kwedd7i,2024-03-25 05:48:23,/r/ETFs/comments/1bmbtcl/what_is_a_correct_time_in_a_week_to_put_500_in_voo/kwedd7i/,"Dividends don’t matter, just make sure to sell while sitting on a charged crystal.",1,ETFs
zebadiah09,kwbs6gc,2024-03-24 19:46:12,/r/ETFs/comments/1bmbtcl/what_is_a_correct_time_in_a_week_to_put_500_in_voo/kwbs6gc/,"Actually, I've been confused about this too but was settled straight after reading another post, so please someone correct me if I'm wrong. Plus I've done this a few times through the last three weeks with no problems.

But to my understanding, I can make a same day transfer to my fidelity account. It'll say I have money to trade but it will still be unsettled. With that said you're still able to make purchases of a share because it's promised money that will be added to your account even though it's not settled yet. BUT what you can't do is sell that same share you purchased until your funds are settled (the 2-3 days later) because that would be in violation and your account would be flagged.",3,ETFs
DaemonTargaryen2024,kwc14g9,2024-03-24 21:06:01,/r/ETFs/comments/1bmbtcl/what_is_a_correct_time_in_a_week_to_put_500_in_voo/kwc14g9/,Look for a platform that lets you put automatic purchases on ETFs. Or buy index funds.,2,ETFs
shekr17,kwcq439,2024-03-24 23:54:50,/r/ETFs/comments/1bmbtcl/what_is_a_correct_time_in_a_week_to_put_500_in_voo/kwcq439/,yes ..all such trades will be executed as market orders. With ETF’s like VOO it should not be a problem as the bid/ask spread is very low.,1,ETFs
fauxpolitik,kwcvsmk,2024-03-25 00:29:23,/r/ETFs/comments/1bmbtcl/what_is_a_correct_time_in_a_week_to_put_500_in_voo/kwcvsmk/,So they can cash out and go fine dining,2,ETFs
apooroldinvestor,kwb80m5,2024-03-24 15:36:48,/r/ETFs/comments/1bmbtcl/what_is_a_correct_time_in_a_week_to_put_500_in_voo/kwb80m5/,"Right, but fretting over $500?.....",-8,ETFs
apooroldinvestor,kwc94hp,2024-03-24 22:05:49,/r/ETFs/comments/1bmbtcl/what_is_a_correct_time_in_a_week_to_put_500_in_voo/kwc94hp/,"It IS insignificant, no matter how you slice it.  $500 today is peanuts.  Maybe in 1960...

He's asking how to ""time"" $500..... it won't make an ounce of difference.  $100k ok I can see maybe worrying about timing",0,ETFs
StoppingPowah,kwbtczd,2024-03-24 19:57:54,/r/ETFs/comments/1bmbtcl/what_is_a_correct_time_in_a_week_to_put_500_in_voo/kwbtczd/,"Oh yeah you’re right, I forgot about that.

I don’t know if Vanguard works the same way. I gave up on Fidelity cause it was too complicated",2,ETFs
Kinu4U,kwbauil,2024-03-24 16:13:36,/r/ETFs/comments/1bmbtcl/what_is_a_correct_time_in_a_week_to_put_500_in_voo/kwbauil/,Maybe for him is a great deal. You don't know his situation. Everyone starts from somewhere. Maybe it's all he can afford. Maybe he has 13 kids,3,ETFs
apooroldinvestor,kwc9usa,2024-03-24 22:10:51,/r/ETFs/comments/1bmbtcl/what_is_a_correct_time_in_a_week_to_put_500_in_voo/kwc9usa/,"He's asking if it makes a difference what day he puts it in if you read the original post. With $500, it doesn't matter. Maybe with $50k sure",0,ETFs
apooroldinvestor,kwc9h74,2024-03-24 22:08:16,/r/ETFs/comments/1bmbtcl/what_is_a_correct_time_in_a_week_to_put_500_in_voo/kwc9h74/,If it's a lot to him. He shouldn't be investing it....,-1,ETFs
Solid_Illustrator640,kw9va0k,2024-03-24 08:31:17,/r/ETFs/comments/1bm6kio/25_years_old_starting_for_200_voo/kw9va0k/,"Whatever your countries retirement account is for individuals.

And buy VOO as much as you can. Turn on DRIP to reinvest the dividends.",12,ETFs
Shykarii,kwa61xx,2024-03-24 09:45:32,/r/ETFs/comments/1bm6kio/25_years_old_starting_for_200_voo/kwa61xx/,I would just keep investing into VOO and never stop.  With time my salary will increase and so my investments into VOO and have tons of money in the future. simple.,6,ETFs
StoppingPowah,kwa006x,2024-03-24 09:03:21,/r/ETFs/comments/1bm6kio/25_years_old_starting_for_200_voo/kwa006x/,I use a regular money market account because I plan to sell everything before I’m 50 so I wouldn’t benefit from a Roth,3,ETFs
_hannibalbarca,kweh8ei,2024-03-25 06:12:23,/r/ETFs/comments/1bm6kio/25_years_old_starting_for_200_voo/kweh8ei/,"Believe it or not, Youre ahead of people much older than you! Keep it up as much as you can.",1,ETFs
Final-Ad-151,kw9qw97,2024-03-24 08:01:21,/r/ETFs/comments/1bm6kio/25_years_old_starting_for_200_voo/kw9qw97/,401k or Roth account I hope if you don’t have any retirement plan yet.,1,ETFs
KlassicoolMewSk,kwbdo3q,2024-03-24 16:51:08,/r/ETFs/comments/1bm6kio/25_years_old_starting_for_200_voo/kwbdo3q/,why not bitcoin ETF?,0,ETFs
Own_Photo_4674,kwfk792,2024-03-25 10:28:53,/r/ETFs/comments/1bm6kio/25_years_old_starting_for_200_voo/kwfk792/,"Voo and bitcoin are terrible investments. What are the yields and dividends. Am I talking to bots here. Everyone seems to recommemd these ridiculous investments. Only the vulnerable will follow.
Like betting on a horse race.
Is there that many ignorant investors .
If you are playing with $200 then go ahead and gamble it . Casino or horse race.
If you want to learn how to reap the rewards watch and listen and learn.",0,ETFs
mostafa_issa98,kwb9nuz,2024-03-24 15:58:16,/r/ETFs/comments/1bm6kio/25_years_old_starting_for_200_voo/kwb9nuz/,"I will search for a retirement account, as I am an expat in kuwait so mostly I wont have a plan for that, and in my  country lebanon the bank are littarly robbers 😂😂",2,ETFs
BKdirty,kwa2t1h,2024-03-24 09:22:46,/r/ETFs/comments/1bm6kio/25_years_old_starting_for_200_voo/kwa2t1h/,Odds are you can pull out contributions penalty free leading up to 59 and then sell off total and you’d be safe. Had you started maxing when you were 18. Roth is a beautiful tool,2,ETFs
mostafa_issa98,kwbdvkt,2024-03-24 16:53:49,/r/ETFs/comments/1bm6kio/25_years_old_starting_for_200_voo/kwbdvkt/,"I need to balance between saving for retirement and being a risk taker, so if i got more than 200$ to invest on etfs, i would out the 200$ in voo and the rest as fun money so i will invest it in Bitcoin, Bitcoin etf is new and wasn't for a long time in the market, so no one actually knows the returns of this ETF for the rest of the year. Maybe be wrong just trying to give a justification for my action",1,ETFs
mostafa_issa98,kwfks5k,2024-03-25 10:33:03,/r/ETFs/comments/1bm6kio/25_years_old_starting_for_200_voo/kwfks5k/,"Warren Buffett and bogle recommend sticking with s&p 500, you know that right?",1,ETFs
Solid_Illustrator640,kwbadyy,2024-03-24 16:07:43,/r/ETFs/comments/1bm6kio/25_years_old_starting_for_200_voo/kwbadyy/,You may be able to use fidelity or something,1,ETFs
BKdirty,kwa2wrx,2024-03-24 09:23:29,/r/ETFs/comments/1bm6kio/25_years_old_starting_for_200_voo/kwa2wrx/,"Assuming 50 is your retirement goal, because you so t burn off all your capital the day you sell lol",1,ETFs
KlassicoolMewSk,kwdqwen,2024-03-25 03:33:20,/r/ETFs/comments/1bm6kio/25_years_old_starting_for_200_voo/kwdqwen/,The etf is new but Bitcoin is 15 years old and has the same market cap as Meta. The current y/y avg % growth is 150% and if Bitcoin was $35k the % growth would still be above 120%. I'm young as well so I don't see the point in avoiding risk because that means I won't get to take advantage of upside potential. What's important is sticking to the plan and keep DCA no matter what.,1,ETFs
StoppingPowah,kwa434c,2024-03-24 09:31:41,/r/ETFs/comments/1bm6kio/25_years_old_starting_for_200_voo/kwa434c/,The goal is like 35 but 50 is more realistic lol,1,ETFs
BKdirty,kwa46l0,2024-03-24 09:32:21,/r/ETFs/comments/1bm6kio/25_years_old_starting_for_200_voo/kwa46l0/,"I hear ya, 45 is my goal",1,ETFs
1LeftShoe,kw5dayi,2024-03-23 11:17:24,/r/ETFs/comments/1blg9sd/21_right_now_with_about_5k_how_does_voo_sound_for/kw5dayi/,"If you open a Roth account and purchase voo in a Roth you can withdraw your principal deposit at any time penalty-free and all of your gains will be tax-free. Your money will grow faster.
You can deposit the whole $5,000, actually you can deposit up to 7,000 per year but your whole $5,000 you can put in today and start using right away.",15,ETFs
RustyBucke,kw50k7f,2024-03-23 09:43:12,/r/ETFs/comments/1blg9sd/21_right_now_with_about_5k_how_does_voo_sound_for/kw50k7f/,Hell yeah brother VOO and chill,20,ETFs
Upbeat_Individual_40,kw7x27b,2024-03-24 01:08:10,/r/ETFs/comments/1blg9sd/21_right_now_with_about_5k_how_does_voo_sound_for/kw7x27b/,"VOO & Chill my guy. 

Open a Roth IRA and max it out, you won’t regret it 30 years from now",4,ETFs
foldinthechhese,kw5578d,2024-03-23 10:16:05,/r/ETFs/comments/1blg9sd/21_right_now_with_about_5k_how_does_voo_sound_for/kw5578d/,"Is the investment Warren Buffett’s wife will use when he dies (90% VOO or comparable and 10% govt bonds) a good idea? Yeah, I’d say he knows more than me or you.",7,ETFs
Glockman19,kw5z6oj,2024-03-23 14:53:41,/r/ETFs/comments/1blg9sd/21_right_now_with_about_5k_how_does_voo_sound_for/kw5z6oj/,"At your age I’d go VUG, QQQM or VGT.",4,ETFs
VT_Sucks,kw54usj,2024-03-23 10:13:37,/r/ETFs/comments/1blg9sd/21_right_now_with_about_5k_how_does_voo_sound_for/kw54usj/,"VOO & Chill. 👍



Just tune out the noise of wealth destroying funds like VXUS and stay the course.",1,ETFs
AdamErne,kw511u1,2024-03-23 09:46:36,/r/ETFs/comments/1blg9sd/21_right_now_with_about_5k_how_does_voo_sound_for/kw511u1/,Cant go wrong with voo,2,ETFs
Automatic_Bandicoot7,kw9xty4,2024-03-24 08:48:24,/r/ETFs/comments/1blg9sd/21_right_now_with_about_5k_how_does_voo_sound_for/kw9xty4/,"SPLG and chill. Same fund exposure, lower expense ratio. Save every penny because why not. Long term it’ll eventually matter.",1,ETFs
RollinginMy77,kweykge,2024-03-25 08:03:06,/r/ETFs/comments/1blg9sd/21_right_now_with_about_5k_how_does_voo_sound_for/kweykge/,lots of solid advice here…I invest in both VOO and VGT look into it!,1,ETFs
ryan1064,kw56fc5,2024-03-23 10:24:51,/r/ETFs/comments/1blg9sd/21_right_now_with_about_5k_how_does_voo_sound_for/kw56fc5/,Take 20% and throw it at VUG or qqq. You are 21 you can handle a bit more risk then just voo but it’s not a bad move to do all voo ofc.,0,ETFs
Fladap28,kw5s0dc,2024-03-23 13:30:23,/r/ETFs/comments/1blg9sd/21_right_now_with_about_5k_how_does_voo_sound_for/kw5s0dc/,Hell yea!,0,ETFs
chopsui101,kw5i54c,2024-03-23 11:56:56,/r/ETFs/comments/1blg9sd/21_right_now_with_about_5k_how_does_voo_sound_for/kw5i54c/,QQQM,1,ETFs
denizonrtx,kw55b4i,2024-03-23 10:16:51,/r/ETFs/comments/1blg9sd/21_right_now_with_about_5k_how_does_voo_sound_for/kw55b4i/,Depends location. In Europe you might be better of with VWCE otherwise VOO is a great option indeed,1,ETFs
Big_Demand_8952,kw5i8hv,2024-03-23 11:57:45,/r/ETFs/comments/1blg9sd/21_right_now_with_about_5k_how_does_voo_sound_for/kw5i8hv/,"If I could give an advice to 21 year old self - I'd put that into Roth IRA & invest in VOO from there. Gains are tax free. You can withdraw after at least 5 years since the investment is made.Penalty-free withdrawal before the age limit has exceptional that includes education, a some more.   


Most importantly, the gain is tax free in the later age.",1,ETFs
dapianoguy,kw5jt0v,2024-03-23 12:11:15,/r/ETFs/comments/1blg9sd/21_right_now_with_about_5k_how_does_voo_sound_for/kw5jt0v/,"Whether 21, age 11, or 121, VOO is right for you. 

Having that said, since you’re so young I’d say if you want to go for growth, go for growth. I’m playing it super risky with only growth but think about 50% VOO and 50% SCHG or MGK or VUG, etc.",1,ETFs
SR252000,kw5sgfq,2024-03-23 13:35:10,/r/ETFs/comments/1blg9sd/21_right_now_with_about_5k_how_does_voo_sound_for/kw5sgfq/,Nice work keep it up,1,ETFs
attanatta,kw5tuck,2024-03-23 13:50:10,/r/ETFs/comments/1blg9sd/21_right_now_with_about_5k_how_does_voo_sound_for/kw5tuck/,"I think SPLG has an ever so slightly lower expense ratio but follows the same index, I believe.",1,ETFs
AutomaticDig2439,kw5wybz,2024-03-23 14:26:09,/r/ETFs/comments/1blg9sd/21_right_now_with_about_5k_how_does_voo_sound_for/kw5wybz/,"You should buy VTI, FSELX and VUG. I make 50-70 dollars a day holding these with 5k invested as well.",1,ETFs
Money_Music_6964,kw6n1xm,2024-03-23 19:49:07,/r/ETFs/comments/1blg9sd/21_right_now_with_about_5k_how_does_voo_sound_for/kw6n1xm/,You can dollar average into Voo…or just buy it now and forget about it,1,ETFs
apooroldinvestor,kw8hbha,2024-03-24 03:10:11,/r/ETFs/comments/1blg9sd/21_right_now_with_about_5k_how_does_voo_sound_for/kw8hbha/,Qqqm,1,ETFs
_blockchainlife,kw543d6,2024-03-23 10:08:09,/r/ETFs/comments/1blg9sd/21_right_now_with_about_5k_how_does_voo_sound_for/kw543d6/,It’s perfect,0,ETFs
labrador45,kw5927x,2024-03-23 10:44:28,/r/ETFs/comments/1blg9sd/21_right_now_with_about_5k_how_does_voo_sound_for/kw5927x/,"TQQQ and forget it! Youre young and that 5k in the grand scheme isnt much. 5K invested in TQQQ 10 years ago would be 500k today.   


This is not advice. Nor is it a ""safe investment"". The risk is EXTREMELY high.",-1,ETFs
RandomNordicGuy,kw6224a,2024-03-23 15:30:34,/r/ETFs/comments/1blg9sd/21_right_now_with_about_5k_how_does_voo_sound_for/kw6224a/,"You know what you should do, open a Roth IRA, do your idea, put it all in VOO, then forget about it. Add as you can but if you're going to be an attorney and make good money, you're not going to miss this. Starting as young as you are especially if you add to it for the first few years out of law school. You just let that puppy go, whatever it grows to when you get older, withdrawal tax-free",0,ETFs
apooroldinvestor,kw8hjpx,2024-03-24 03:11:36,/r/ETFs/comments/1blg9sd/21_right_now_with_about_5k_how_does_voo_sound_for/kw8hjpx/,Heck with only $5000 I'd put it all in msft nvda googl,0,ETFs
heythxvoo,kw9z1uo,2024-03-24 08:56:43,/r/ETFs/comments/1blg9sd/21_right_now_with_about_5k_how_does_voo_sound_for/kw9z1uo/,I can remove principal from my Roth IRA without penalty?  I had no idea.,1,ETFs
Merlyn_Bageltown,kw838lg,2024-03-24 01:45:12,/r/ETFs/comments/1blg9sd/21_right_now_with_about_5k_how_does_voo_sound_for/kw838lg/,"To add on to this, you still have about a week to contribute to your 2023 ROTH limit. I'd recommend opening a Roth IRA with Fidelity (or Vanguard or any other, Fidelity is just my personal preference) and tossing all of your 5K in a Roth IRA for 2023 and do it pronto. This will allow you to still contribute 7K for 2024, which I also recommend, because at your age it will do amazing things with the amount of time it can be in the market. In terms of ETF spread, the safest broadest option is VT, followed by a split of VTI and VXUS, VOO is slightly more aggressive than either of these approaches, and QQQM a step more aggressive. At your age VOO is perfectly reasonable. I'm 25 and my strategy is 40% QQQM 40% VTI and 20% VXUS to favor my exposure towards large cap tech stocks. This breakdown of my ETF choices is not financial advise, and is probably an overly complicated way to end up with a similar risk to just going all in on VOO. The part about the 2023 Roth IRA is worth considering with more weight though.",1,ETFs
__chrd__,kwam15c,2024-03-24 11:47:54,/r/ETFs/comments/1blg9sd/21_right_now_with_about_5k_how_does_voo_sound_for/kwam15c/,Let’s clarify this a little better. First the account needs to be at least 5 years old. You need to make sure you only withdraw your contributions and not your earnings. If both those are the case then yes you can withdraw penalty free before 59 1/2. If you back door in those funds gotta sit first. Can be annoying if you do it frequently.,0,ETFs
bushysmalls,kw6iqzp,2024-03-23 19:02:58,/r/ETFs/comments/1blg9sd/21_right_now_with_about_5k_how_does_voo_sound_for/kw6iqzp/,Turn on DRIP and walk away,3,ETFs
BigRailWillFail,kw5hb2c,2024-03-23 11:49:54,/r/ETFs/comments/1blg9sd/21_right_now_with_about_5k_how_does_voo_sound_for/kw5hb2c/,"Buffett is a good investor sure, but he’s totally changed after Mungers influence, along with the fact he was in before markets became what they were today; people couldn’t price an option in the 1960s well. His name also buys him seats at tables most people can’t and gets deals off of his name, that he built granted. It became  self fulfilling prophecy but I don’t think he’d duplicate the results of his career if he had to start in 2019.",-2,ETFs
CoupleStunning,kw9ggqn,2024-03-24 06:51:46,/r/ETFs/comments/1blg9sd/21_right_now_with_about_5k_how_does_voo_sound_for/kw9ggqn/,The username and profile picture hahahaa,0,ETFs
magnesium195,kw7m9za,2024-03-24 00:02:14,/r/ETFs/comments/1blg9sd/21_right_now_with_about_5k_how_does_voo_sound_for/kw7m9za/,"HI, Why would you say VWCE is better for Europe?",0,ETFs
Intelligent_Flow6872,kw82o2b,2024-03-24 01:41:47,/r/ETFs/comments/1blg9sd/21_right_now_with_about_5k_how_does_voo_sound_for/kw82o2b/,"You can withdrawal contributes at anytime, only have to wait 5 years to withdrawal any gains made",0,ETFs
Automatic_Bandicoot7,kw9xxbv,2024-03-24 08:49:02,/r/ETFs/comments/1blg9sd/21_right_now_with_about_5k_how_does_voo_sound_for/kw9xxbv/,🎯,1,ETFs
1LeftShoe,kw5egc1,2024-03-23 11:26:34,/r/ETFs/comments/1blg9sd/21_right_now_with_about_5k_how_does_voo_sound_for/kw5egc1/,"Bad advice, TQQQ is a leveraged vehicle not something you would hold for 10 years. You would never get the returns you're talking about because it would be eroded by time, it's not what TQQQ is for. Same applies to all leveraged vehicles like GUSH and others. 

TQQQ, also known as Proshares Ultrapro QQQ, is one of the largest leveraged ETFs that tracks the Nasdaq-100 index. TQQQ is typically used by day traders because it was built for short-holding periods.",3,ETFs
