author,id,created_utc,permalink,body,score,subreddit
lotterytix,kwh3sji,2024-03-25 20:10:23,/r/ETFs/comments/1bmqbxg/new_to_investing_is_voo_vtv_2_good_etfs_to_start/kwh3sji/,"Maybe consider VOO and a mid/small cap value fund instead of VTV.  There is nearly 60% overlap between those two funds.  Check out VBR, CALF, or AVUV.",1,ETFs
AlgoTradingQuant,kwczgum,2024-03-25 00:51:21,/r/ETFs/comments/1bmoom7/diversifying_my_ira_for_the_long_haul_is_100_voo/kwczgum/,I’m retired and hold a 100% equities portfolio…  it’s risky (At your age) to be less than 100% equities.,8,ETFs
foldinthechhese,kwdbk25,2024-03-25 02:02:08,/r/ETFs/comments/1bmoom7/diversifying_my_ira_for_the_long_haul_is_100_voo/kwdbk25/,"The more experienced investors recommend a blend of VOO and an international fund like VXUS. VXUS has been mostly flat for the last 10 years. The way it’s been described to me is you want to load up on international when it’s on discount because there will be years where it goes way up and the US market is down. It’s a hedge in a way between the 2. The safest investment would be investing in the whole world in something like VT. I prefer more US exposure as it’s 60% US and 40% international. But in all honesty, VOO, VTI, or VT would all be acceptable for a 1 fund. VOO is the least diverse, but also has the highest returns over the last decade. Mixing in VXUS is probably the wisest thing to do. In any case, starting at 21, you will have a lot of zeros in your account when you’re older. Maxing out retirement accounts in your 20’s is probably the best financial decision you could ever make.

ETA: It may not matter to you but Warren Buffet has said his wife will be invested in VOO 100% when he dies and recommends that to most investors.",5,ETFs
SirChetManly,kwd6nto,2024-03-25 01:33:43,/r/ETFs/comments/1bmoom7/diversifying_my_ira_for_the_long_haul_is_100_voo/kwd6nto/,"It isn't *risky* by any stretch. You're excluding some asset classes that typically outperform large cap (small and mid caps) and expose yourself to single-country risk by avoiding international diversification. That said, you're still well-diversified in an asset class that is likely to continue to do well over your career.

I'm personally a huge advocate for target-date funds because they decrease the risk of behavioral errors like performance-chasing and market-timing that could hurt you more than anything.",2,ETFs
ZAROV8862,kwei3zo,2024-03-25 06:17:54,/r/ETFs/comments/1bmoom7/diversifying_my_ira_for_the_long_haul_is_100_voo/kwei3zo/,Enough said :)),2,ETFs
ZAROV8862,kwei97t,2024-03-25 06:18:48,/r/ETFs/comments/1bmoom7/diversifying_my_ira_for_the_long_haul_is_100_voo/kwei97t/,Makes sense...,2,ETFs
ChemicalBonus5853,kwe4s84,2024-03-25 04:56:26,/r/ETFs/comments/1bmoom7/diversifying_my_ira_for_the_long_haul_is_100_voo/kwe4s84/,"VXUS is large, mid and small cap.
VEA and VWO are large cap.

is that correct? I like VXUS but I don’t like that it is 75% Developed and 25% Emerging, too much id a difference, also considering Developed markets is way more tied to US performance than Emerging",0,ETFs
foldinthechhese,kwf8rwa,2024-03-25 09:09:58,/r/ETFs/comments/1bmoom7/diversifying_my_ira_for_the_long_haul_is_100_voo/kwf8rwa/,You can use VEA and VWO to your desired allocation. I’ve seen some say split it 50/50.,2,ETFs
jlevy73,kwfcydo,2024-03-25 09:38:22,/r/ETFs/comments/1bmoom7/diversifying_my_ira_for_the_long_haul_is_100_voo/kwfcydo/,">VEA and VWO are large cap

You can approximate VXUS with a 3:1 ratio of developed (VEA) and emerging (VWO) market funds.",2,ETFs
ChemicalBonus5853,kwh2jf7,2024-03-25 19:59:42,/r/ETFs/comments/1bmoom7/diversifying_my_ira_for_the_long_haul_is_100_voo/kwh2jf7/,"Yeah, I use 10% and 10% each cuz VWO has less correlation with US market",1,ETFs
TheDreadnought75,kwcz7mg,2024-03-25 00:49:52,/r/ETFs/comments/1bmmt1i/i_made_over_50000_on_nvdia_thinking_about_selling/kwcz7mg/,You never go broke taking profits.,71,ETFs
stephenzacko,kwcnk08,2024-03-24 23:39:04,/r/ETFs/comments/1bmmt1i/i_made_over_50000_on_nvdia_thinking_about_selling/kwcnk08/,"If it were me, I'd trim my initial investment to invest in VOO. That way you have a free ride in NVDA. Maybe take a little more from NVDA for taxes.",47,ETFs
BehelitSam,kwd7c4e,2024-03-25 01:37:38,/r/ETFs/comments/1bmmt1i/i_made_over_50000_on_nvdia_thinking_about_selling/kwd7c4e/,"You’ve made money off a single stock, there’s nothing wrong with going the safe route and investing in the S&P 500",17,ETFs
cosmic_backlash,kwcle5p,2024-03-24 23:25:38,/r/ETFs/comments/1bmmt1i/i_made_over_50000_on_nvdia_thinking_about_selling/kwcle5p/,"Always hard to say in these situations. You don't have to sell all though, you can trim your position. Could do 5, 10, 25 etc if you want to take some risk off and diversify.",36,ETFs
nicpro85,kwcnh8m,2024-03-24 23:38:36,/r/ETFs/comments/1bmmt1i/i_made_over_50000_on_nvdia_thinking_about_selling/kwcnh8m/,"You made 50k maybe but what matters for a good answer is your buying date, price and position size.",13,ETFs
Fladap28,kwcti5v,2024-03-25 00:15:32,/r/ETFs/comments/1bmmt1i/i_made_over_50000_on_nvdia_thinking_about_selling/kwcti5v/,Take your profits and keep the rest in nvda,10,ETFs
ellsmirip25,kwcwziv,2024-03-25 00:36:35,/r/ETFs/comments/1bmmt1i/i_made_over_50000_on_nvdia_thinking_about_selling/kwcwziv/,Take premium invested plus some profits and put it somewhere safe that way you don’t hang yourself later for losing all profits,3,ETFs
FuzzyZine,kwcw34y,2024-03-25 00:31:08,/r/ETFs/comments/1bmmt1i/i_made_over_50000_on_nvdia_thinking_about_selling/kwcw34y/,"What are other comments talking about? Sold this shit as soon as possible, before you lost it as fast as you earned it",6,ETFs
mightyduck19,kwdok47,2024-03-25 03:19:25,/r/ETFs/comments/1bmmt1i/i_made_over_50000_on_nvdia_thinking_about_selling/kwdok47/,"Probably a great idea. Sure, the risk is that you miss on further outperformance, but the benefit is that you lock in the alpha. And honestly, given how central NVDA is to the current discussion, it’s probably the time to sell. Everyone is frothing over it",2,ETFs
ZealousidealTune9481,kwe286f,2024-03-25 04:41:00,/r/ETFs/comments/1bmmt1i/i_made_over_50000_on_nvdia_thinking_about_selling/kwe286f/,Smart,2,ETFs
OccidoViper,kwe6oi7,2024-03-25 05:07:55,/r/ETFs/comments/1bmmt1i/i_made_over_50000_on_nvdia_thinking_about_selling/kwe6oi7/,"I bought NVIDIA at 200. Already had sold some shares to get my original investment plus 50%.  Now, just going to let it ride for a bit",2,ETFs
pancyfalace,kwekvqe,2024-03-25 06:35:19,/r/ETFs/comments/1bmmt1i/i_made_over_50000_on_nvdia_thinking_about_selling/kwekvqe/,"Take the money and run. Sell at least part of it, that way if it goes to the moon you still have some exposure, if it drops, you know you cashed in at the height",2,ETFs
Curious_Criticism134,kwfl1ad,2024-03-25 10:34:53,/r/ETFs/comments/1bmmt1i/i_made_over_50000_on_nvdia_thinking_about_selling/kwfl1ad/,I believe you should not liquidate your whole position. Scalp the gains and let the rest ride IMHO,2,ETFs
Aggravating_Owl_9092,kwg8cj4,2024-03-25 14:05:27,/r/ETFs/comments/1bmmt1i/i_made_over_50000_on_nvdia_thinking_about_selling/kwg8cj4/,You ask in r/etfs? lol…,2,ETFs
Low-Age4017,kwd3yxj,2024-03-25 01:17:58,/r/ETFs/comments/1bmmt1i/i_made_over_50000_on_nvdia_thinking_about_selling/kwd3yxj/,I reckon you could sell a few and invest that in VOO. As I’ve heard NVIDA could grow for the next two quarters.,3,ETFs
Southwick_24,kwdysku,2024-03-25 04:20:24,/r/ETFs/comments/1bmmt1i/i_made_over_50000_on_nvdia_thinking_about_selling/kwdysku/,"New money into VOO, leave your NVDA position alone.",3,ETFs
ThinkBig247,kwe6g2j,2024-03-25 05:06:30,/r/ETFs/comments/1bmmt1i/i_made_over_50000_on_nvdia_thinking_about_selling/kwe6g2j/,"I think NVDA still going to run up for the next couple of years, it would suck to jump off this wave and miss out on the ride up.",4,ETFs
Rocket_Man54321,kwcibe9,2024-03-24 23:06:16,/r/ETFs/comments/1bmmt1i/i_made_over_50000_on_nvdia_thinking_about_selling/kwcibe9/,Just start DCAing VOO.  Swapping always has fucked me over.,2,ETFs
Maddog351_2023,kwdi235,2024-03-25 02:40:38,/r/ETFs/comments/1bmmt1i/i_made_over_50000_on_nvdia_thinking_about_selling/kwdi235/,Split 3 way,1,ETFs
Commercial-Taro684,kwdtp72,2024-03-25 03:50:04,/r/ETFs/comments/1bmmt1i/i_made_over_50000_on_nvdia_thinking_about_selling/kwdtp72/,Is this in a tax advantaged account?,1,ETFs
IcyProfession5657,kwdviw9,2024-03-25 04:00:59,/r/ETFs/comments/1bmmt1i/i_made_over_50000_on_nvdia_thinking_about_selling/kwdviw9/,Good,1,ETFs
Doogy44,kwe1w7b,2024-03-25 04:39:00,/r/ETFs/comments/1bmmt1i/i_made_over_50000_on_nvdia_thinking_about_selling/kwe1w7b/,"Take some profit occasionally, but as long as NVDA is still turning larger and larger profits each quarter, you gotta keep something in it IMO … The amt of profit you take is up to you - for me, Im waiting for the 1 year mark before I take out the amt I originally put in plus 30% … whatever that ends up being mid-August. If NVDA still going strong like it has been, Ill take profit occasionally after that to diversify - maybe just yearly to somewhat balance portfolio - its been so strong it has my portfolio unbalanced now - that is a good thing tho - been a very strong investment.",1,ETFs
vikingpower89,kweh1y8,2024-03-25 06:11:15,/r/ETFs/comments/1bmmt1i/i_made_over_50000_on_nvdia_thinking_about_selling/kweh1y8/,"When I have a single stock pop off like that, I trim it down to an amount that I'm comfortable seeing decrease significantly, but also enough to generate more gains if it continues up. Then I reinvest the profit into something new or something a deem more ""stable"" like a VUG type ETF.",1,ETFs
Elprocesso,kwek4vi,2024-03-25 06:30:38,/r/ETFs/comments/1bmmt1i/i_made_over_50000_on_nvdia_thinking_about_selling/kwek4vi/,"Are you in an IRA:
If yes- possibly, esp if u are near retirement and want to own less equities
If no- absolutely not. Your gonna owe too many taxes for it to be worthwhile.",1,ETFs
Significant-Safe7458,kwezlf9,2024-03-25 08:09:46,/r/ETFs/comments/1bmmt1i/i_made_over_50000_on_nvdia_thinking_about_selling/kwezlf9/,"Take your cost basis out and let the rest run, assuming you’re up over 100% at least.",1,ETFs
Possible_Wisdom,kwf7kxl,2024-03-25 09:01:56,/r/ETFs/comments/1bmmt1i/i_made_over_50000_on_nvdia_thinking_about_selling/kwf7kxl/,Is there any REIT etfs that compares with InfraCap PFFR etf yield of 7.7 percent?,1,ETFs
StrongBoyTwoFive,kwfj0j8,2024-03-25 10:20:21,/r/ETFs/comments/1bmmt1i/i_made_over_50000_on_nvdia_thinking_about_selling/kwfj0j8/,how much did u have to invest in nvidia to make a profit of $50k?,1,ETFs
Available_Fig3826,kwfureu,2024-03-25 11:49:05,/r/ETFs/comments/1bmmt1i/i_made_over_50000_on_nvdia_thinking_about_selling/kwfureu/,"Take some profits but for the most part, let your winners run, think in 10 years if you'll think, damn i wish I kept some more NVDA",1,ETFs
hlyyyy,kwfy1l7,2024-03-25 12:17:39,/r/ETFs/comments/1bmmt1i/i_made_over_50000_on_nvdia_thinking_about_selling/kwfy1l7/,Imagine selling the most valuable company in the world,1,ETFs
Krapule1,kwgpphk,2024-03-25 17:47:06,/r/ETFs/comments/1bmmt1i/i_made_over_50000_on_nvdia_thinking_about_selling/kwgpphk/,First off take initial investment out do it twice so thats a 100%. Then take the same amount put it in voo and keep the rest in nvdia,1,ETFs
Expelleddux,kwgxvq3,2024-03-25 19:17:18,/r/ETFs/comments/1bmmt1i/i_made_over_50000_on_nvdia_thinking_about_selling/kwgxvq3/,Even better go VTI,1,ETFs
ChipmunkSuch4907,kwh3alm,2024-03-25 20:06:10,/r/ETFs/comments/1bmmt1i/i_made_over_50000_on_nvdia_thinking_about_selling/kwh3alm/,depends on your financial goals and the amount of risk you would like to stay exposed to. There's absolutely nothing wrong with taking your profits now and investing in VOO. I would personally decide this based on my investment horizon/timeline,1,ETFs
HickoryHill79,kwhks4y,2024-03-25 22:10:57,/r/ETFs/comments/1bmmt1i/i_made_over_50000_on_nvdia_thinking_about_selling/kwhks4y/,If you sell I’d start a position in an ETF such as SMH to maintain exposure to NVDA and other stocks in the semiconductor sector,1,ETFs
Nero8,kwhnios,2024-03-25 22:27:39,/r/ETFs/comments/1bmmt1i/i_made_over_50000_on_nvdia_thinking_about_selling/kwhnios/,Yeah probably sell and diversify but you might want to look into some long dated nvda calls,1,ETFs
Avinates,kwdh4c1,2024-03-25 02:35:05,/r/ETFs/comments/1bmmt1i/i_made_over_50000_on_nvdia_thinking_about_selling/kwdh4c1/,"UBS just raised Price target to 1100 for NVDA
*",1,ETFs
Smart_Ostrich9127,kwe9d2z,2024-03-25 05:24:08,/r/ETFs/comments/1bmmt1i/i_made_over_50000_on_nvdia_thinking_about_selling/kwe9d2z/,is it too late to invest in nvidia,0,ETFs
apooroldinvestor,kwclm53,2024-03-24 23:27:03,/r/ETFs/comments/1bmmt1i/i_made_over_50000_on_nvdia_thinking_about_selling/kwclm53/,Sure you did...,-13,ETFs
iiSquatS,kwegw6s,2024-03-25 06:10:15,/r/ETFs/comments/1bmmt1i/i_made_over_50000_on_nvdia_thinking_about_selling/kwegw6s/,"I would do this. Maybe leave 10k in nvda and the other 40k over to VOO. I know anything can happen to any company, but NVDA is the clear leader in something that will be around for a long, long time. They’re like the Ely Lilly’s of semi conductors.",12,ETFs
bsptown,kweq9ie,2024-03-25 07:09:32,/r/ETFs/comments/1bmmt1i/i_made_over_50000_on_nvdia_thinking_about_selling/kweq9ie/,Agree! 💯,2,ETFs
throwawaycitylimits,kwdhtx2,2024-03-25 02:39:17,/r/ETFs/comments/1bmmt1i/i_made_over_50000_on_nvdia_thinking_about_selling/kwdhtx2/,One thing I do is sell my original investment so I can put it to another. Then you play with house money.,9,ETFs
Swole_Bodry,kwdpviq,2024-03-25 03:27:15,/r/ETFs/comments/1bmmt1i/i_made_over_50000_on_nvdia_thinking_about_selling/kwdpviq/,"To me this isn’t a hard thing to do. A good outcome can come out of a bad decision. Overweighting risks  idiosyncratic to a single company or sector isn’t really sensible in my honest opinion. It’s awesome you made this money OP, but the most reliable results come from diversification, exposing yourself only to prices risks.",1,ETFs
TorrenceMightingale,kwgzbsy,2024-03-25 19:31:13,/r/ETFs/comments/1bmmt1i/i_made_over_50000_on_nvdia_thinking_about_selling/kwgzbsy/,*decades,1,ETFs
brandonAlexander21,kwe8ugq,2024-03-25 05:21:01,/r/ETFs/comments/1bmmt1i/i_made_over_50000_on_nvdia_thinking_about_selling/kwe8ugq/,I know that’s what I’m afraid of too 😮‍💨,1,ETFs
meaningseekingsoul,kwdu12d,2024-03-25 03:52:03,/r/ETFs/comments/1bmmt1i/i_made_over_50000_on_nvdia_thinking_about_selling/kwdu12d/, Why did it?,2,ETFs
Megaghost66,kwe3d4g,2024-03-25 04:47:53,/r/ETFs/comments/1bmmt1i/i_made_over_50000_on_nvdia_thinking_about_selling/kwe3d4g/,Yeah why,2,ETFs
brandonAlexander21,kwfl4zd,2024-03-25 10:35:38,/r/ETFs/comments/1bmmt1i/i_made_over_50000_on_nvdia_thinking_about_selling/kwfl4zd/,"Invested 230,000",2,ETFs
BigRailWillFail,kweadx8,2024-03-25 05:30:18,/r/ETFs/comments/1bmmt1i/i_made_over_50000_on_nvdia_thinking_about_selling/kweadx8/,UBS is not the firm I’d want to be taking analysis from,2,ETFs
pREDDITcation,kwec687,2024-03-25 05:41:02,/r/ETFs/comments/1bmmt1i/i_made_over_50000_on_nvdia_thinking_about_selling/kwec687/,many don’t think so,2,ETFs
Business_Designer_78,kwcvad0,2024-03-25 00:26:20,/r/ETFs/comments/1bmmt1i/i_made_over_50000_on_nvdia_thinking_about_selling/kwcvad0/,"NVDA has been going on a crazy tear for about a decade now. Plenty of people made a lot of money on them. 

Just because you missed the boat doesn't mean everyone else did. 

lol, stay bitter.",11,ETFs
foldinthechhese,kwcxlyz,2024-03-25 00:40:19,/r/ETFs/comments/1bmmt1i/i_made_over_50000_on_nvdia_thinking_about_selling/kwcxlyz/,10k in NVDA invested in 2010 would be worth almost 2 million today. Keep up.,3,ETFs
Ilikethngsnstf,kwd4a4e,2024-03-25 01:19:47,/r/ETFs/comments/1bmmt1i/i_made_over_50000_on_nvdia_thinking_about_selling/kwd4a4e/,"I made $17k, too bad you didn't invest at $127 like me 🤷🏼‍♂️ hahaha",2,ETFs
Rocket_Man54321,kwead7x,2024-03-25 05:30:10,/r/ETFs/comments/1bmmt1i/i_made_over_50000_on_nvdia_thinking_about_selling/kwead7x/,"Cuz I lose my cost basis that I had for the first asset, then typically buy high for the new one.  Better to just DCA slowly into the new one and just hold the original one.",1,ETFs
Avinates,kwemzfa,2024-03-25 06:48:37,/r/ETFs/comments/1bmmt1i/i_made_over_50000_on_nvdia_thinking_about_selling/kwemzfa/,What firms would you take analysis from?,1,ETFs
Avinates,kwenn6j,2024-03-25 06:52:46,/r/ETFs/comments/1bmmt1i/i_made_over_50000_on_nvdia_thinking_about_selling/kwenn6j/,What firms do you follow for analysis?,1,ETFs
apooroldinvestor,kwcwk45,2024-03-25 00:34:00,/r/ETFs/comments/1bmmt1i/i_made_over_50000_on_nvdia_thinking_about_selling/kwcwk45/,I'm in since 144. But I don't believe everything I read..,-7,ETFs
apooroldinvestor,kwcy7qa,2024-03-25 00:43:56,/r/ETFs/comments/1bmmt1i/i_made_over_50000_on_nvdia_thinking_about_selling/kwcy7qa/,Right but most people in here weren't invested in 2010....,1,ETFs
apooroldinvestor,kwd4ith,2024-03-25 01:21:10,/r/ETFs/comments/1bmmt1i/i_made_over_50000_on_nvdia_thinking_about_selling/kwd4ith/,"You didn't make anything until you sell...

And then you'll lose it all in your next stock pick ...

Ahahahahaaaa and that's why 95% of traders lose",1,ETFs
apooroldinvestor,kwd4nh4,2024-03-25 01:21:56,/r/ETFs/comments/1bmmt1i/i_made_over_50000_on_nvdia_thinking_about_selling/kwd4nh4/,"I bought 200 shares at 144 and still hold them...

Do the math bud....",1,ETFs
Megaghost66,kwf1mh9,2024-03-25 08:22:57,/r/ETFs/comments/1bmmt1i/i_made_over_50000_on_nvdia_thinking_about_selling/kwf1mh9/,❤️,2,ETFs
BigRailWillFail,kwfdcf5,2024-03-25 09:41:02,/r/ETFs/comments/1bmmt1i/i_made_over_50000_on_nvdia_thinking_about_selling/kwfdcf5/,Mainly pure buy side firms,1,ETFs
Business_Designer_78,kwcx4z4,2024-03-25 00:37:28,/r/ETFs/comments/1bmmt1i/i_made_over_50000_on_nvdia_thinking_about_selling/kwcx4z4/,hahaha,4,ETFs
foldinthechhese,kwczi0j,2024-03-25 00:51:33,/r/ETFs/comments/1bmmt1i/i_made_over_50000_on_nvdia_thinking_about_selling/kwczi0j/,$10k last year would be worth $54k today.,3,ETFs
Ilikethngsnstf,kwd5pex,2024-03-25 01:28:06,/r/ETFs/comments/1bmmt1i/i_made_over_50000_on_nvdia_thinking_about_selling/kwd5pex/,"Oh got it, so you don't trust Reddit users, I can see that haha.",2,ETFs
Ilikethngsnstf,kwd7193,2024-03-25 01:35:54,/r/ETFs/comments/1bmmt1i/i_made_over_50000_on_nvdia_thinking_about_selling/kwd7193/,Sure you did....,3,ETFs
ChemicalBonus5853,kwcxpkk,2024-03-25 00:40:54,/r/ETFs/comments/1bmmt1i/i_made_over_50000_on_nvdia_thinking_about_selling/kwcxpkk/,bro missed the boat,3,ETFs
apooroldinvestor,kwcyg98,2024-03-25 00:45:21,/r/ETFs/comments/1bmmt1i/i_made_over_50000_on_nvdia_thinking_about_selling/kwcyg98/,You probably made $500 and added a couple 0s and still live in moms basment,-4,ETFs
apooroldinvestor,kwd1bqe,2024-03-25 01:02:20,/r/ETFs/comments/1bmmt1i/i_made_over_50000_on_nvdia_thinking_about_selling/kwd1bqe/,"Yes, but redditors don't have $10k and live eith mommy and work at uber.",1,ETFs
apooroldinvestor,kwd5ybx,2024-03-25 01:29:34,/r/ETFs/comments/1bmmt1i/i_made_over_50000_on_nvdia_thinking_about_selling/kwd5ybx/,Stick with index funds bro,1,ETFs
apooroldinvestor,kwd7tfp,2024-03-25 01:40:24,/r/ETFs/comments/1bmmt1i/i_made_over_50000_on_nvdia_thinking_about_selling/kwd7tfp/,Believe what you want kiddo,1,ETFs
apooroldinvestor,kwcylu9,2024-03-25 00:46:18,/r/ETFs/comments/1bmmt1i/i_made_over_50000_on_nvdia_thinking_about_selling/kwcylu9/,"Are you in at 144?..... oh right let me guess ...
 You're in at $20 a share right?..... ahahaaa sure",-1,ETFs
apooroldinvestor,kwcycbs,2024-03-25 00:44:42,/r/ETFs/comments/1bmmt1i/i_made_over_50000_on_nvdia_thinking_about_selling/kwcycbs/,How did I since it's going to $2000 a share in 5 years ...?,-6,ETFs
Business_Designer_78,kwd02xp,2024-03-25 00:54:58,/r/ETFs/comments/1bmmt1i/i_made_over_50000_on_nvdia_thinking_about_selling/kwd02xp/,">You probably made $500 and added a couple 0s and still live in moms basment

You realize that like an hour ago you [wrote](https://new.reddit.com/r/findapath/comments/1bmlh3b/comment/kwcpjkk/?context=3) that you are 50 years old and live with your mother waiting to inherit her house?

Ordinarily I wouldn't laugh at someone in that situation, unless they were being a twat, and in that case, hahaha.",2,ETFs
ChemicalBonus5853,kwd3ax3,2024-03-25 01:14:04,/r/ETFs/comments/1bmmt1i/i_made_over_50000_on_nvdia_thinking_about_selling/kwd3ax3/,its over for bro,4,ETFs
apooroldinvestor,kwd11cc,2024-03-25 01:00:37,/r/ETFs/comments/1bmmt1i/i_made_over_50000_on_nvdia_thinking_about_selling/kwd11cc/,"Yes, I help my elderly parents and am proud of it. Not stuck with a $2500 mortgage and I invest instead.  Have fun",-2,ETFs
apooroldinvestor,kwd45l0,2024-03-25 01:19:03,/r/ETFs/comments/1bmmt1i/i_made_over_50000_on_nvdia_thinking_about_selling/kwd45l0/,"That's what they told me at 144. I was mocked by people like you saying "" dude, you're an idiot it's going to $80 a share!!""....

Well  1.5 years later it's at $900 a share..... ahahahahahahahahahaa",-2,ETFs
Business_Designer_78,kwd1ryy,2024-03-25 01:05:03,/r/ETFs/comments/1bmmt1i/i_made_over_50000_on_nvdia_thinking_about_selling/kwd1ryy/,"People who live in mom's glass house shouldn't be throwing stones.

hahaha",4,ETFs
ChemicalBonus5853,kwd64qc,2024-03-25 01:30:36,/r/ETFs/comments/1bmmt1i/i_made_over_50000_on_nvdia_thinking_about_selling/kwd64qc/,boat=missed,3,ETFs
apooroldinvestor,kwd3gmp,2024-03-25 01:15:00,/r/ETFs/comments/1bmmt1i/i_made_over_50000_on_nvdia_thinking_about_selling/kwd3gmp/,"It's my house also. If you made $50k, you wouldn't be asking what to do with it. You would've asked a lot earlier...",-1,ETFs
apooroldinvestor,kwd3wrf,2024-03-25 01:17:37,/r/ETFs/comments/1bmmt1i/i_made_over_50000_on_nvdia_thinking_about_selling/kwd3wrf/,"...... and if you made $50k in nvda why wouldn't you hold at very least half of it for the future?

Shows you're making it up. 

You think nvda is done going up forever?

It's the only stocks that matters. Shows you don't have what it takes to hold to $3000 a share.

Yes, voo for you",-1,ETFs
apooroldinvestor,kwd7nvi,2024-03-25 01:39:31,/r/ETFs/comments/1bmmt1i/i_made_over_50000_on_nvdia_thinking_about_selling/kwd7nvi/,"See that's what naive people think. Check back in 5 years when nvda is $2000 a share.

Of course, short timers like you won't have the patience to hold...",0,ETFs
ChemicalBonus5853,kwd9qq8,2024-03-25 01:51:32,/r/ETFs/comments/1bmmt1i/i_made_over_50000_on_nvdia_thinking_about_selling/kwd9qq8/,"Bro im messing with you, even if you buy now, 10 or 20 years from now you will make money. U good bro",2,ETFs
