author,id,created_utc,permalink,body,score,subreddit
Doogy44,kvnrc8c,2024-03-20 07:58:50,/r/ETFs/comments/1biurw6/similar_stock_to_voo/kvnrc8c/,"Ive always thought Berkshire B’s (BRK.B) stock pretty much is an ETF that was created before there were ETFs … they do a great job year to year … I put them in my ETF category personally, even though they technically arent an ETF because of their diverse and vast holdings.",1,ETFs
Swerve99,kvou406,2024-03-20 12:30:50,/r/ETFs/comments/1biurw6/similar_stock_to_voo/kvou406/,BBUS. one of the lowest expense ratios out there.,1,ETFs
faxanaduu,kvncj7r,2024-03-20 06:28:15,/r/ETFs/comments/1biurw6/similar_stock_to_voo/kvncj7r/,"If you want a potential great performer on a bull run look into qqqm or vug or schg. 

Im 46 but like schd. I just like that it seems pretty stable. Does grow, and dividend reinvests. It's only 5% of my one IRA, however. 

My bread and butter is voo but I have some big 7 stocks, brk.b, semi etfs like smh. Im just spread across taxable brokerage, IRA, 401k. 

If I could do it again id ne more risky at a younger age. Im actually more risky now than I was at 25. I grew up with mo money so it was hard to initially deal with risk.",1,ETFs
ninja0310,kvoyeud,2024-03-20 13:13:28,/r/ETFs/comments/1biurw6/similar_stock_to_voo/kvoyeud/,"https://preview.redd.it/h8ppxwygafpc1.jpeg?width=1179&format=pjpg&auto=webp&s=a8eed4b6c507581f4d196767c67280c4300c4f0c

This is what my employer 401k offer for selection aside from a target fund / bond. Is ideally state street sp500 over other vanguard fund listed?",1,ETFs
ninja0310,kvmzeqg,2024-03-20 05:13:01,/r/ETFs/comments/1biurw6/similar_stock_to_voo/kvmzeqg/,"So youre saying at my age, with time in market, i should do both account 401k and roth ira into sp500 for overall growth/returns?

I read somewhere about having some dividends return in your portfolio , unless i might mistaken this information as something to do towards closer years of retirement?",1,ETFs
nostratic,kvo4xsg,2024-03-20 09:25:12,/r/ETFs/comments/1biurw6/similar_stock_to_voo/kvo4xsg/,">Why are you investing in SCHD at 31

because it has value stocks with reliable cashflows?",1,ETFs
ninja0310,kvn04d2,2024-03-20 05:17:00,/r/ETFs/comments/1biurw6/similar_stock_to_voo/kvn04d2/,"Would it be disadvantages to go in schd in roth account? Or would going both 401k and ira into sp500 (mmwvt and voo) be better overall long term? 

Im assuming its due to growth stock / returns / dividend, all reinvesting as i have some time considering 31 years old?",1,ETFs
fugoogletwitter,kvnrbxs,2024-03-20 07:58:47,/r/ETFs/comments/1biurw6/similar_stock_to_voo/kvnrbxs/,You ever look into USD semi LETF? Been playing around with that just to see how it works. I am around same age and just getting into more risk to lol.,1,ETFs
gnygren3773,kvn8gw3,2024-03-20 06:04:32,/r/ETFs/comments/1biurw6/similar_stock_to_voo/kvn8gw3/,If you want to live off of dividends in the future you can always relocate your assets. At your age people tend to recommend growth stocks over dividends because dividends paying companies are less focused on expanding their businesses.,5,ETFs
AICHEngineer,kvnp2hv,2024-03-20 07:44:48,/r/ETFs/comments/1biurw6/similar_stock_to_voo/kvnp2hv/,"For all stages of the life cycle, owning market cap weight index funds is statistically superior to focusing on dividend payments. 

You just sell shares, it's the same tax treatment as qualified dividends and the total portfolio value change is exactly the same whether you sell shares or reap dividends.",5,ETFs
simplehuman77,kvofpv6,2024-03-20 10:37:04,/r/ETFs/comments/1biurw6/similar_stock_to_voo/kvofpv6/,Ok and? Investing in growth or even the general S&P will outperform SCHD long term. Then when you are a few years from retirement you start transitioning. You will have more shares of SCHD or whatever dividend fund in the end this way. If you are young as is OP and have 20-30+ years before retirement there is no reason to be in SCHD.,2,ETFs
LordOibes,kvn0i00,2024-03-20 05:19:10,/r/ETFs/comments/1biurw6/similar_stock_to_voo/kvn0i00/,It depends on what you are looking for I don't really have an opinion on the matter. People here don't value dividende as much. You could ask your question or r/Dividends and probably get the opposite answer,1,ETFs
faxanaduu,kvnw3q7,2024-03-20 08:28:39,/r/ETFs/comments/1biurw6/similar_stock_to_voo/kvnw3q7/,"Nope not familiar. It's a leveraged semiconductor etf? 

Ive considered some of those maybe the qqq one but not right now. The market right now seems like it could go either way. Tomorrow... Red or green shitshow? Probably one or the other, lol, have no idea which way. Crazy times.",1,ETFs
ninja0310,kvoyg19,2024-03-20 13:13:49,/r/ETFs/comments/1biurw6/similar_stock_to_voo/kvoyg19/,"https://preview.redd.it/4tpvcdeoafpc1.jpeg?width=1179&format=pjpg&auto=webp&s=b4ac5c4b53ce347e340b01dc69664c6f73f8c760

This is what my employer 401k offer for selection aside from a target fund / bond. Is ideally state street sp500 over other vanguard fund listed?",0,ETFs
nostratic,kvo5mkz,2024-03-20 09:29:41,/r/ETFs/comments/1biurw6/similar_stock_to_voo/kvo5mkz/,">For all stages of the life cycle, owning market cap weight index funds is statistically superior to focusing on dividend payments.

sorry, that's complete nonsense and unsupported by the data. 

a) Dividend paying stocks outperform, long-term. 

>Dividend investing has historically outperformed both the broader market and value investing, and at the same time shown lower risk. Dividend investing ‘overlap’ with both value investing and low-volatility investing, but is an independent investment style of its own. The specific reasons for the outperformance of dividend investing are a reduction in the agency costs associated with high free cash flows and a probable systematic mispricing (undervaluation) of high dividend paying stocks. Dividend investing sees fewer years with losses, which according to prospect theory adds significant utility to investor experience. The outperformance of high dividend yield stocks has been robust over the 1928-2011 timeframe. Since the underlying reasons for this outperformance are more behavioral in nature than institutional, chances are that history will repeat itself. 

https://papers.ssrn.com/sol3/papers.cfm?abstract_id=2056317

b) Market cap weighting is literally the worst way to invest. Weight stocks literally any other way, LITERALLY, and it will beat market cap weighting. Weight by dividends, book value, earning, revenue, even randomly and it will give better long-term results than market-cap weighting. 

part 1: https://papers.ssrn.com/sol3/papers.cfm?abstract_id=2242028

part 2: https://papers.ssrn.com/sol3/papers.cfm?abstract_id=2242034",-1,ETFs
ninja0310,kvn1ez3,2024-03-20 05:24:20,/r/ETFs/comments/1biurw6/similar_stock_to_voo/kvn1ez3/,"Basically long term investing, just deposit and fund the account and forget about it. Given my age 31, Im sure ill ride the ups and down and try not to worry into it as much as i can.",1,ETFs
fugoogletwitter,kvo4zlp,2024-03-20 09:25:32,/r/ETFs/comments/1biurw6/similar_stock_to_voo/kvo4zlp/,Wait until they lower interest rates than 2007 all over again is what worries me. Yeah been up and down with everything except S&P 500.,2,ETFs
faxanaduu,kvoc1md,2024-03-20 10:12:05,/r/ETFs/comments/1biurw6/similar_stock_to_voo/kvoc1md/,"Yup. Jeez I really what tomorrow will bring, nevermind lowered interest rates lol",1,ETFs
fugoogletwitter,kvogve8,2024-03-20 10:45:07,/r/ETFs/comments/1biurw6/similar_stock_to_voo/kvogve8/,When 2007 happened they panicked and lowered rates fast which was too late and damage was done. Fed is never right so my guess they will fracture economy again and we will have decent buying opportunities if you still have a job.,1,ETFs
faxanaduu,kvohizf,2024-03-20 10:49:47,/r/ETFs/comments/1biurw6/similar_stock_to_voo/kvohizf/,"Ive kept a stash of cash on hand for buying opportunities, but damn they haven't materialized. What's the first think you buy? If we have a decent drop I might spread out in some small cap etf like vb, then vug. Maybe buy something like first solar. Otherwise, not sure. Maybe pick up some discount Microsoft or Amazon too.",1,ETFs
fugoogletwitter,kvoia8m,2024-03-20 10:55:14,/r/ETFs/comments/1biurw6/similar_stock_to_voo/kvoia8m/,Probably QQQM made a lot of money vs what I put in during last recession. Plus probably buy VOO or SPY. Not a fan of buying individual stocks I suck at that.,2,ETFs
faxanaduu,kvojvxi,2024-03-20 11:06:57,/r/ETFs/comments/1biurw6/similar_stock_to_voo/kvojvxi/,Gotcha. VOO is my bread and butter! I like QQQM too. Lately more intrigued with VUG but want a lower entry point.,2,ETFs
fugoogletwitter,kvokqat,2024-03-20 11:13:14,/r/ETFs/comments/1biurw6/similar_stock_to_voo/kvokqat/,Good idea with VUG haven’t put much thought into it. Looks like expense ratio more reasonable than QQQ/M with similar performance.,2,ETFs
AngusMcTibbins,kvmsuy7,2024-03-20 04:36:34,/r/ETFs/comments/1biubzn/bought_voo_for_the_first_time_spaxx_showed_up_out/kvmsuy7/,"Spaxx is just cash. If you put money in your fidelity account, it goes under Spaxx. The reason it is showing that much is because your purchase of VOO is still finalizing (that's why it says ""pending activity""). So it will disappear in a few days",21,ETFs
Solid_Illustrator640,kvo1hba,2024-03-20 09:02:47,/r/ETFs/comments/1biubzn/bought_voo_for_the_first_time_spaxx_showed_up_out/kvo1hba/,Spaxx is unfinalized cash being used for VOO. Just ignore it,5,ETFs
datstanc26,kvt6fnq,2024-03-21 07:18:00,/r/ETFs/comments/1biubzn/bought_voo_for_the_first_time_spaxx_showed_up_out/kvt6fnq/,"Fidelity accounts call it the “core” position, it’s virtually cash and when the stock trade clears it will go away 🙂 every time you add money it will first go into the core position until you make a new trade ",1,ETFs
OverReyted,kvm1vzz,2024-03-20 02:06:31,/r/ETFs/comments/1bipkzl/lets_settle_it_once_and_for_all_spy_or_voo_for/kvm1vzz/,"“Settle it once and for all” 

You must be new here.",39,ETFs
Fun_Grapefruit_3416,kvlv74e,2024-03-20 01:29:28,/r/ETFs/comments/1bipkzl/lets_settle_it_once_and_for_all_spy_or_voo_for/kvlv74e/,"VOO for long term because it’s cheaper

SPY for long term if you plan on doing options",20,ETFs
ChemicalBonus5853,kvlzhk9,2024-03-20 01:53:10,/r/ETFs/comments/1bipkzl/lets_settle_it_once_and_for_all_spy_or_voo_for/kvlzhk9/,VOO is cheaper and the Vanguard logo looks cooler,28,ETFs
Rob1iam,kvlxdld,2024-03-20 01:41:34,/r/ETFs/comments/1bipkzl/lets_settle_it_once_and_for_all_spy_or_voo_for/kvlxdld/,"You don’t sell covered calls if you’re investing for the long term. Selling a covered call exposes you to having your shares called away, which is conceptually the opposite of being a long term buy and hold investor. At the end of the day SPY is a traders ETF and VOO is an investors ETF. 

Also, the assertion that selling covered calls will objectively enhance your returns is just flat out wrong. Selling a call option caps your upside, exposing you to potentially unlimited missed gains. There’s even backtesting data showing that a covered call/cash secured put strategy on the S&P 500 underperforms buy and hold long term.",8,ETFs
Hancock02,kvltm9v,2024-03-20 01:20:46,/r/ETFs/comments/1bipkzl/lets_settle_it_once_and_for_all_spy_or_voo_for/kvltm9v/,SPLG,8,ETFs
cambergangev,kvlvpwp,2024-03-20 01:32:21,/r/ETFs/comments/1bipkzl/lets_settle_it_once_and_for_all_spy_or_voo_for/kvlvpwp/,Would rather hold VTI in my Roth,6,ETFs
Firm_Investment_2764,kvlxjoa,2024-03-20 01:42:30,/r/ETFs/comments/1bipkzl/lets_settle_it_once_and_for_all_spy_or_voo_for/kvlxjoa/,If it’s in your Roth you can sell your VOO shares and buy SPY. You could Sell a Put option and get paid to buy SPY once it falls to your target price.,2,ETFs
AllaboutVOO,kvlyldx,2024-03-20 01:48:17,/r/ETFs/comments/1bipkzl/lets_settle_it_once_and_for_all_spy_or_voo_for/kvlyldx/,VOO,2,ETFs
socraticrex,kvm4fgs,2024-03-20 02:20:38,/r/ETFs/comments/1bipkzl/lets_settle_it_once_and_for_all_spy_or_voo_for/kvm4fgs/,VOO,2,ETFs
illuminati5770,kvm7g9u,2024-03-20 02:37:33,/r/ETFs/comments/1bipkzl/lets_settle_it_once_and_for_all_spy_or_voo_for/kvm7g9u/,VOO,2,ETFs
According-Aide-443,kvm88n2,2024-03-20 02:41:54,/r/ETFs/comments/1bipkzl/lets_settle_it_once_and_for_all_spy_or_voo_for/kvm88n2/,VOO,2,ETFs
EP009,kvmp3w8,2024-03-20 04:15:44,/r/ETFs/comments/1bipkzl/lets_settle_it_once_and_for_all_spy_or_voo_for/kvmp3w8/,This is it. The post that will definitely settle this topic. Bookmark it because that question will never be asked here or any other investment related subreddit again.,2,ETFs
MatterSignificant969,kvlyny8,2024-03-20 01:48:41,/r/ETFs/comments/1bipkzl/lets_settle_it_once_and_for_all_spy_or_voo_for/kvlyny8/,Brown shoe vs slightly cheaper brown shoe. Let's settle thism,3,ETFs
ChicoIke,kvlvecd,2024-03-20 01:30:34,/r/ETFs/comments/1bipkzl/lets_settle_it_once_and_for_all_spy_or_voo_for/kvlvecd/,Splg,1,ETFs
doggz109,kvmefet,2024-03-20 03:16:17,/r/ETFs/comments/1bipkzl/lets_settle_it_once_and_for_all_spy_or_voo_for/kvmefet/,SPLG,1,ETFs
SensitiveReveal5976,kvmiya0,2024-03-20 03:41:38,/r/ETFs/comments/1bipkzl/lets_settle_it_once_and_for_all_spy_or_voo_for/kvmiya0/,VOo,1,ETFs
Iamanon12345,kvmrb97,2024-03-20 04:27:58,/r/ETFs/comments/1bipkzl/lets_settle_it_once_and_for_all_spy_or_voo_for/kvmrb97/,I like boo because it has a slightly lower expense ratio and I don’t trade options,1,ETFs
VT_Sucks,kvnilkf,2024-03-20 07:05:01,/r/ETFs/comments/1bipkzl/lets_settle_it_once_and_for_all_spy_or_voo_for/kvnilkf/,VOO,1,ETFs
MrAndrewJackson,kvm0s7p,2024-03-20 02:00:18,/r/ETFs/comments/1bipkzl/lets_settle_it_once_and_for_all_spy_or_voo_for/kvm0s7p/,VTI VXUS AVUV AVDV in roth,1,ETFs
johndawkins1965,kvmcnb9,2024-03-20 03:06:20,/r/ETFs/comments/1bipkzl/lets_settle_it_once_and_for_all_spy_or_voo_for/kvmcnb9/,That’s cheaper but I’ve discovered cheaper doesn’t actually mean cheaper.   With SPLG your shares are less valuable from my understanding,-2,ETFs
ChetesGaming,kvprajt,2024-03-20 19:02:29,/r/ETFs/comments/1bipkzl/lets_settle_it_once_and_for_all_spy_or_voo_for/kvprajt/,This is the way,1,ETFs
MONGSTRADAMUS,kvme6oi,2024-03-20 03:14:55,/r/ETFs/comments/1bipkzl/lets_settle_it_once_and_for_all_spy_or_voo_for/kvme6oi/,For the record splg has higher total returns than voo for the life of the fund so it’s probably fine for a replacement for voo. I never heard of it being less valuable,0,ETFs
johndawkins1965,kvmnxh6,2024-03-20 04:09:10,/r/ETFs/comments/1bipkzl/lets_settle_it_once_and_for_all_spy_or_voo_for/kvmnxh6/, Yea SPLG has performed better than VOO.    Actually I’m curious as to what’s the benefits in going with a cheaper ETF rather than a more expensive one when they track the same fund.   Yes you get more shares for the same money but it’s still the same thing. If voo is 400 a share and SPLG is 50 a share.  If I put in $800 in voo I’ll have two shares. If I put in $800 in SPLG I’ll have 16 shares.  But I still have $800 in an ETF that tracks the s&p 500    Am I off the mark here or what,-1,ETFs
MONGSTRADAMUS,kvmx4pi,2024-03-20 05:00:13,/r/ETFs/comments/1bipkzl/lets_settle_it_once_and_for_all_spy_or_voo_for/kvmx4pi/,Only issue I would foresee is that if you have to buy complete shares voo is around 472 and splg is around 60. If you only have 600 to buy per month you can buy 10 shares of splg with no money in sidelines while with voo you can only buy one share and 128 dollars on sidelines pretty minor thing but if you only want to dca something to consider.,1,ETFs
andybmcc,kvw62zi,2024-03-21 22:31:08,/r/ETFs/comments/1bipkzl/lets_settle_it_once_and_for_all_spy_or_voo_for/kvw62zi/,"You're not wrong, not sure why this is being downvoted.  Only real caveat is crappy brokers that don't allow partial ETF share purchases.",1,ETFs
CommercialCuts,kvn6ko4,2024-03-20 05:53:43,/r/ETFs/comments/1bipkzl/lets_settle_it_once_and_for_all_spy_or_voo_for/kvn6ko4/,You can buy fractional ETF shares,1,ETFs
MONGSTRADAMUS,kvn795z,2024-03-20 05:57:36,/r/ETFs/comments/1bipkzl/lets_settle_it_once_and_for_all_spy_or_voo_for/kvn795z/,Not everywhere like Schwab and tda for example if you have access to partial shares and you only want voo then that’s an option. In general though splg is cheaper er wise also and has slightly outperformed voo historically.,3,ETFs
CommercialCuts,kvn8bce,2024-03-20 06:03:38,/r/ETFs/comments/1bipkzl/lets_settle_it_once_and_for_all_spy_or_voo_for/kvn8bce/,I didn’t say fractional ETF shares were available “everywhere.” Not everyone knows that you can even buy Fractional ETFs,1,ETFs
Embarrassed_Time_146,kvjwkpw,2024-03-19 16:44:25,/r/ETFs/comments/1biekfv/voo_and_avuv/kvjwkpw/,"Maybe add some international. VXUS and AVDV would be fine if you like to diversify between large cap and small value.

On the other hand, depending on your risk tolerance, maybe add some bonds. If you are young, you don’t really need to.",6,ETFs
simpleman357,kvjszza,2024-03-19 15:56:27,/r/ETFs/comments/1biekfv/voo_and_avuv/kvjszza/,Just chill and don't over complicate things.,3,ETFs
faxanaduu,kvktvdg,2024-03-19 21:52:37,/r/ETFs/comments/1bica3o/voo_for_first_time_investor/kvktvdg/,"VOO is my base but QQQM, VUG, VB, and sector specific SMH are good plays too, imo.",1,ETFs
StoppingPowah,kvkxdk1,2024-03-19 22:14:35,/r/ETFs/comments/1bica3o/voo_for_first_time_investor/kvkxdk1/,Yes VOO is amazing,1,ETFs
cd80808080,kvjhxaf,2024-03-19 13:39:37,/r/ETFs/comments/1bica3o/voo_for_first_time_investor/kvjhxaf/,"In your 20's ..you have roughly 40 years + till retirement.  

Add Growth plays like schg, FTEC, XLK, QQQM, VUG.  I get the Voo and chill arguement.  But a good Growith fund (plenty out there) has beat VOO on the 1-5 and 10 year look back.",0,ETFs
ThisCupIsPurple,kvjlt9i,2024-03-19 14:25:09,/r/ETFs/comments/1bica3o/voo_for_first_time_investor/kvjlt9i/,"Hell, QQQM has got VOO beat over 20 years too.",0,ETFs
eagles16106,kvj41d7,2024-03-19 11:30:13,/r/ETFs/comments/1bialdk/dollar_cost_average_voo/kvj41d7/,Lump sum usually wins.,47,ETFs
reset43,kvj63vu,2024-03-19 11:46:58,/r/ETFs/comments/1bialdk/dollar_cost_average_voo/kvj63vu/,Lump,7,ETFs
peterinjapan,kvjbt2g,2024-03-19 12:36:57,/r/ETFs/comments/1bialdk/dollar_cost_average_voo/kvjbt2g/,"If you research it, the math ALWAYS says to dump a lump sump in now, but I get the DCA argument. The important thing is to keep the money coming in, if you can kick $10-20k into the market every year your future self will thank you.",5,ETFs
isolated_808,kvj5ab7,2024-03-19 11:40:08,/r/ETFs/comments/1bialdk/dollar_cost_average_voo/kvj5ab7/,"that's a fairly large amount. if it was me, i'd do dca. even if it wasn't, i'd still do dca as i personally like doing that vs. lump sum. encourages me to continue investing.

EDIT: 30% of of 82k is around 25k. i thought initially it was investing all 82k. that's around $480 per week for 52 weeks?",8,ETFs
Wooden-Buddy-3945,kvkhptr,2024-03-19 20:27:12,/r/ETFs/comments/1bialdk/dollar_cost_average_voo/kvkhptr/,"I'm in a similar situation. I lump summed 30% last month and plan to DCA the rest over the next 6 months. If you want to wait an entire year, that means you believe market is gonna crash soon, in which case you shouldn't even enter the market now, LS or DCA. Just hold everything and lump sum next year then.",5,ETFs
brightmare01,kvleox1,2024-03-19 23:55:57,/r/ETFs/comments/1bialdk/dollar_cost_average_voo/kvleox1/,Let's say the market (VOO) grows at 10% annually for the next 5 years and bear market hits with a 30% drop your still up... dump it all and buy,2,ETFs
shit-at-work69,kvlpkk7,2024-03-20 00:58:12,/r/ETFs/comments/1bialdk/dollar_cost_average_voo/kvlpkk7/,"Doesn’t matter. Over the long term, it’s gonna be good",2,ETFs
Embarrassed_Time_146,kvjs2dl,2024-03-19 15:44:17,/r/ETFs/comments/1bialdk/dollar_cost_average_voo/kvjs2dl/,"Why are you investing only 30%? I’d ser aside 6 months of expenses and whatever I’m not planning on using for the next 5 years and invest the rest.

As people say, research says that lump sum investing beats dca 2/3 of the time. Markets tend to up and lump sum gets you earlier in the market.

You can do something in between if you are anxious about investing it all at once. The Money Guy has a rule that you can follow:

1. If the sum you are investing is less than 10% of your net worth, invest it all at once.

2. If not, invest what would constitute that 10% at once, and add one month (up to a year) for each additional 5%.

So if you’re only investing 24,2 K (even though you should probably invest more), you could invest 8,200 the first month, and 4,100 for the next four months.",1,ETFs
SilverDem0n,kvjxbsl,2024-03-19 16:54:17,/r/ETFs/comments/1bialdk/dollar_cost_average_voo/kvjxbsl/,"Lump sum is best approach to maximize gains, as others have explained. DCA is best approach if the fear of losses is preventing you putting any money into the fund.

But don't forget that even if you DCA it in over 52 weeks, the market can still crash in week 53. And you'd still be down - temporarily - whether you lump-sum'd or DCA'd, as the market does not care which one you choose.",1,ETFs
ultimateF_21,kvky971,2024-03-19 22:19:56,/r/ETFs/comments/1bialdk/dollar_cost_average_voo/kvky971/,I don’t understand why you would ask if you’re blatantly arguing the very clear consensus of what everyone is telling you. Seems like you had your mind made before you even posted. What’s the point of asking if you don’t care for anyone’s advice?,1,ETFs
MajorFish04,kvlai6i,2024-03-19 23:32:11,/r/ETFs/comments/1bialdk/dollar_cost_average_voo/kvlai6i/,Yeah I’d do something similar.  Money markets are earning 5%.,1,ETFs
makeitjain,kvmmdvw,2024-03-20 04:00:34,/r/ETFs/comments/1bialdk/dollar_cost_average_voo/kvmmdvw/,Is this in a retirement or taxable account?,1,ETFs
Darksight78,kvmnf34,2024-03-20 04:06:20,/r/ETFs/comments/1bialdk/dollar_cost_average_voo/kvmnf34/,"Why Vanguard ETF?

SPY or ishares ETF are great too.

Stop Vanguard lobbying!",1,ETFs
Solid_Illustrator640,kvn85kt,2024-03-20 06:02:43,/r/ETFs/comments/1bialdk/dollar_cost_average_voo/kvn85kt/,Lump sum if you have it. Dollar cost if you do it every pay check. Time in the market beats fart in the spark kit or whatever,1,ETFs
frankiebev,kvnwxlt,2024-03-20 08:33:53,/r/ETFs/comments/1bialdk/dollar_cost_average_voo/kvnwxlt/,Dump it use m1 for borrow if you worried about having access to liquidity fast 82k in VOO > anything else,1,ETFs
cd80808080,kvjd880,2024-03-19 12:50:26,/r/ETFs/comments/1bialdk/dollar_cost_average_voo/kvjd880/,"Man if I was in my 20's.  Sure Id buy buy some S & P tracking index.  But damn, I'd also put 1/2 in a growth fund.  Just go look at 5-10-20 year charts.  Tech is the way, and it's only gonna ramp up.  

Sure you might have a year where you have a draw down of 38%, but look what happens in those years after.  

At age 25.  I'm minimum 50% into something like schg, VUG, FTEC, XLK, QQQM.  Easy decision.",1,ETFs
None,kvjiks6,2024-03-19 13:46:56,/r/ETFs/comments/1bialdk/dollar_cost_average_voo/kvjiks6/,[deleted],-4,ETFs
Early-Ladder-9793,kvjgxxb,2024-03-19 13:28:47,/r/ETFs/comments/1bialdk/dollar_cost_average_voo/kvjgxxb/,"Dca vs lump sum is a trade off between risk vs return. 

Since the market is on average growing higher, lump sum usually means better return. But DCA smoothes out market fluctuation so it reduces your risk exposed to the market.",0,ETFs
ChiII_Bee,kvj4rn0,2024-03-19 11:35:59,/r/ETFs/comments/1bialdk/dollar_cost_average_voo/kvj4rn0/,How?,5,ETFs
ChiII_Bee,kvj5sxp,2024-03-19 11:44:26,/r/ETFs/comments/1bialdk/dollar_cost_average_voo/kvj5sxp/,"I agree 100% - I am in it for the long run 10+ years

I am also dumping a large portion of my savings each year until I move out of my folks place. Once I move out and have more expenses I will lower the percentage from 30% to 25% to 20%, etc",-1,ETFs
Zealousideal-Play130,kvoj77q,2024-03-20 11:01:55,/r/ETFs/comments/1bialdk/dollar_cost_average_voo/kvoj77q/,"I did something similar. Psychologically it helps to split it up to some degree, but it’s also a relief once it’s all in and just set it and forget it.",1,ETFs
ChiII_Bee,kvkz7ik,2024-03-19 22:25:42,/r/ETFs/comments/1bialdk/dollar_cost_average_voo/kvkz7ik/,I don’t understand your comment either. I’m paying attention to everyone’s response. You want me to yes man every response I get? I am not a robot I have the right to push back and have a healthy conversation,1,ETFs
ChiII_Bee,kvoi4io,2024-03-20 10:54:03,/r/ETFs/comments/1bialdk/dollar_cost_average_voo/kvoi4io/,Taxable,1,ETFs
h39ga,kvn7rtv,2024-03-20 06:00:32,/r/ETFs/comments/1bialdk/dollar_cost_average_voo/kvn7rtv/,Vanguard ETF offers better expense ratio as well as dividend yield for essentially the same product as SPY.,1,ETFs
Stayinginvested389,kvkqy3o,2024-03-19 21:33:44,/r/ETFs/comments/1bialdk/dollar_cost_average_voo/kvkqy3o/,"I Like qqqm, ftec is a little risky, 2 holdings make up 40% of the index",2,ETFs
Embarrassed_Time_146,kvjsehc,2024-03-19 15:48:42,/r/ETFs/comments/1bialdk/dollar_cost_average_voo/kvjsehc/,"Don’t try to time the market. It is always a bad idea. There is always someone that’s going to tell you that is a bad time for investing. The reality is that nobody knows.

All time highs tend to to be followed by all time highs. So, according to what has happened historically, the market can continue its upward trend for a while before dropping down again.

Who knows what’s going to happen? If you’re going to dca, at least start at once.",2,ETFs
waresmarufy,kvjkwgv,2024-03-19 14:14:07,/r/ETFs/comments/1bialdk/dollar_cost_average_voo/kvjkwgv/,"Yep,that's what I'm doing",1,ETFs
