author,id,created_utc,permalink,body,score,subreddit
massivecalvesbro,kvn0jbc,2024-03-20 05:19:22,/r/ETFs/comments/1bi0chz/why_i_like_vti_or_voo_but_not_vxus/kvn0jbc/,Feel like this is OPs burner acct commenting,1,ETFs
doomshallot,kviden5,2024-03-19 08:28:39,/r/ETFs/comments/1bi0chz/why_i_like_vti_or_voo_but_not_vxus/kviden5/,"Yeah you make more good points here too, but I think you're missing the bigger picture. There are definitely more negatives than positives with international compared to the US, but that's probably why the market caps are so heavily favored towards the US as well. It still isn't a reason to COMPLETELY ignore everything outside of the US.

Look at it this way. Don't even separate them by the country in which they are headquartered. Just look at a top down list of ALL tradable stocks on the world's open market. They have a never-ending list (lets just call it thousands) of factors to consider for each individual company. Only a small portion of those factors (some of which you listed) are determined by their geographical location. If it's in the US, they're positive markers. If they're outside of the US, they COULD be negative markers. But why are these few factors enough to completely exclude all of these stocks? The market deems their worth in the price, after considering ALL factors, and you should respect that worth, regardless of which land they reside on.

I'm neither advocating for only VTI or only VXUS. I'm simply advocating for participating in the global market, and buy all companies in the world, because index investing says we can and should trust whatever market cap is assigned to each tradable stock.",3,ETFs
rstocksmod_sukmydik,kvkhoij,2024-03-19 20:26:55,/r/ETFs/comments/1bi0chz/why_i_like_vti_or_voo_but_not_vxus/kvkhoij/,">Also yes Denmark is beating the USA ytd

...you Novo Nordisk is beating the S&P500 and without it Denmark would be another stagnant Socialist shithole...",-1,ETFs
Nice_Item2093,kvj61r2,2024-03-19 11:46:29,/r/ETFs/comments/1bi0chz/why_i_like_vti_or_voo_but_not_vxus/kvj61r2/,"I have no doubt but china IS becoming more “capitalist” to an extent, and their middle class IS the fastest growing in the world. Middle class drives economies. With that being said we’re seeing India become a manufacturing power house slowly and Apple is an example of this as well. Especially Indian micro caps will do well going forward but will be VERY volatile haha. I do have majority of my investments into the USA market but I wish there were bettter funds to fee ratios for the other markets . However with that being said Chinese market is filled with corruption so it’s so incredibly risky man.",2,ETFs
cost0much,kvinxm7,2024-03-19 09:36:40,/r/ETFs/comments/1bi0chz/why_i_like_vti_or_voo_but_not_vxus/kvinxm7/,"That's just plain false. On a historical basis, US vs International outperformance is about 50/50. More reading:  
[reddit.com/r/Bogleheads/comments/15eu4uf/how\_the\_us\_manages\_to\_outperform\_exus\_not](https://www.reddit.com/r/Bogleheads/comments/15eu4uf/how_the_us_manages_to_outperform_exus_not)

[reddit.com/r/Bogleheads/comments/1afers1/i\_dont\_get\_the\_love\_for\_vti\_and\_think\_vt\_makes](https://www.reddit.com/r/Bogleheads/comments/1afers1/i_dont_get_the_love_for_vti_and_think_vt_makes)",4,ETFs
rao-blackwell-ized,kvis06y,2024-03-19 10:03:36,/r/ETFs/comments/1bi0chz/why_i_like_vti_or_voo_but_not_vxus/kvis06y/,">but the 100 year trend is overwhelmingly in favor of **a global portfolio**. 

FTFY. 

See DMS dataset. Or see Faber referencing it often, or even Cederburg's recent paper.

Again, please stop making blatantly false statements.

>In the long run it always comes down to business fundamentals (earnings growth). 

Business fundamentals? Those [haven't favored the US either](https://www.aqr.com/Insights/Perspectives/The-Long-Run-Is-Lying-to-You).",4,ETFs
TheYoungSquirrel,kvki6y8,2024-03-19 20:30:59,/r/ETFs/comments/1bi0chz/why_i_like_vti_or_voo_but_not_vxus/kvki6y8/,But what about 200-400 BC?,2,ETFs
Solid_Illustrator640,kvhgr08,2024-03-19 05:10:18,/r/ETFs/comments/1bi0chz/why_i_like_vti_or_voo_but_not_vxus/kvhgr08/,Yeah VT is just not a good idea.,8,ETFs
OlexiySamokysha,kvhnw2r,2024-03-19 05:51:23,/r/ETFs/comments/1bi0chz/why_i_like_vti_or_voo_but_not_vxus/kvhnw2r/,"Quick question: Why do you think VT isn't good? :)

I've been considering investing 1% into VT for the benefit of future generations. I'm thinking of including something in my will along these lines:

Upon my passing, withdraw half of the VT holdings to use as you see fit. Leave the remaining half in VT, and begin contributing an additional 1% for the next generation.",1,ETFs
Solid_Illustrator640,kvj5lef,2024-03-19 11:42:42,/r/ETFs/comments/1bi0chz/why_i_like_vti_or_voo_but_not_vxus/kvj5lef/,"The difference is, in democracies, they come back. Now that XI has been the head for 10 years, it is never coming back. They are closing themselves off and want to go to war. That is in their own words and the spies of every NATO country. The idea of investing in a country that will destroy you company whenever they want, makes no sense to me. They have shown you what they will do to you stocks.",1,ETFs
VT_Sucks,kvhux52,2024-03-19 06:33:27,/r/ETFs/comments/1bi0chz/why_i_like_vti_or_voo_but_not_vxus/kvhux52/,"I prefer to keep my retirement money away from regimes currently putting children in concentration death camps. 


Although it's likely China will see a historical bullrun after Xi's death is announced.",1,ETFs
RijnBrugge,kvhjhrb,2024-03-19 05:25:58,/r/ETFs/comments/1bi0chz/why_i_like_vti_or_voo_but_not_vxus/kvhjhrb/,"Am EU based: it’s like saying US has major problems because Mississippi is poor, or because Detroit industry collapsed or whatever. Production in Germany ultimately suffers because now the German factories are 500 km East in Poland or the Czech Republic, both of which just went through a decade of rapid development. I agree with sp500 funds being a good idea for retail investors but companies like ASML, Novo Nordisk and Airbus are absolutely companies I want to hold. Especially ASML. So yeah the sentiment is somewhat reductionist.",6,ETFs
VT_Sucks,kviinsv,2024-03-19 09:02:16,/r/ETFs/comments/1bi0chz/why_i_like_vti_or_voo_but_not_vxus/kviinsv/,👍,1,ETFs
rao-blackwell-ized,kvil3y4,2024-03-19 09:18:11,/r/ETFs/comments/1bi0chz/why_i_like_vti_or_voo_but_not_vxus/kvil3y4/,">If the US goes down I’m skeptical that international stocks are going to offer much help.  They certainly didn’t during the global financial crisis.  That was centered in the US but foreign stocks suffered an even greater drawdown during that period.

You perhaps misunderstand what I mean when I talk about the ""risk"" of buying 1 single country. I'm talking about potential decades-long protracted bear markets, not sudden crashes with quick recoveries like March 2020. 

Again, I'd highly encourage you to see Bernstein on such ""deep risks."" The book (if you can call it that; it's basically a 50-page essay that you can read in one sitting) is [here](https://www.amazon.com/Deep-Risk-History-Portfolio-Investing/dp/0988780313/).

The Lost Decade is actually a decent example of what I'm talking about. Imagine the retiree withdrawing annually and not replenishing those withdrawals. After 10 years: US down 10%, Emerging Markets up 155%.

I simply acknowledge that I can't predict the future and I diversify accordingly.

>The supposed diversification benefit of international equities wasn’t there when it was needed the most.

I just showed you how this is yet another statement of yours that is just demonstrably untrue.

Of course we expect positively correlated markets to crash together over a short period. The recovery times and idiosyncratic events are another story. 

One need only glance at Russia, Germany, and Japan as salient examples of the risk of unknown unknowns.",3,ETFs
Fun_Grapefruit_3416,kvijlpj,2024-03-19 09:08:21,/r/ETFs/comments/1bi0chz/why_i_like_vti_or_voo_but_not_vxus/kvijlpj/,"Respectfully, your “view” doesn’t matter.",2,ETFs
Incredible__Lobster,kvhjjmc,2024-03-19 05:26:16,/r/ETFs/comments/1bi0chz/why_i_like_vti_or_voo_but_not_vxus/kvhjjmc/,"Dr. Jekyll, Mr. Hyde?",1,ETFs
rao-blackwell-ized,kvissgp,2024-03-19 10:08:50,/r/ETFs/comments/1bi0chz/why_i_like_vti_or_voo_but_not_vxus/kvissgp/,">Who else will post returns?

The US has been the best performing market in only 2 of the last 15 years...",1,ETFs
giraloco,kvicd10,2024-03-19 08:22:00,/r/ETFs/comments/1bi0chz/why_i_like_vti_or_voo_but_not_vxus/kvicd10/,In a major world crisis? Probably no one.,0,ETFs
RijnBrugge,kvhk0rj,2024-03-19 05:28:58,/r/ETFs/comments/1bi0chz/why_i_like_vti_or_voo_but_not_vxus/kvhk0rj/,and industrial isolationism,3,ETFs
giraloco,kvhkn9k,2024-03-19 05:32:33,/r/ETFs/comments/1bi0chz/why_i_like_vti_or_voo_but_not_vxus/kvhkn9k/,"A fascist government that disrupts the world order is unlikely to end well. Corporate monopolies will get even worse with no oversight. People have no idea the advantages the US has. They will flush our future down the toilet. Huge tax cuts for corporations boost short term profits but also increase the deficit. It's not sustainable. We need major cuts in defense and a fair tax system. If not, inflation will spike, bonds and stocks will crash. There will be no place to hide.",3,ETFs
rao-blackwell-ized,kvv7h5u,2024-03-21 17:58:37,/r/ETFs/comments/1bi0chz/why_i_like_vti_or_voo_but_not_vxus/kvv7h5u/,"Bogle also hated ETFs and wanted more corporate bonds in BND. 

Thankfully Bogleheads don't follow every single piece of his advice rigidly.",0,ETFs
None,kvi4f4d,2024-03-19 07:31:54,/r/ETFs/comments/1bi0chz/why_i_like_vti_or_voo_but_not_vxus/kvi4f4d/,I agree 10% is pointless.  I am ready to pay the taxes on the gains (LTCG) to exit the laggard ETFs at this point.  I be I would be better off even in a dividend ETF like SCHD or growth fund like SCHG.,1,ETFs
eddyboomtron,kvtvp0j,2024-03-21 09:57:45,/r/ETFs/comments/1bi0chz/why_i_like_vti_or_voo_but_not_vxus/kvtvp0j/,You're welcome,2,ETFs
TheYoungSquirrel,kvkhynz,2024-03-19 20:29:10,/r/ETFs/comments/1bi0chz/why_i_like_vti_or_voo_but_not_vxus/kvkhynz/,It’s hard to argue with math when math maths.,1,ETFs
VT_Sucks,kvnmbv3,2024-03-20 07:27:58,/r/ETFs/comments/1bi0chz/why_i_like_vti_or_voo_but_not_vxus/kvnmbv3/,"Not the same person. 😕 


Do you have anything of substance to add on here?",2,ETFs
T33FMEISTER,kvuuqg7,2024-03-21 15:17:38,/r/ETFs/comments/1bi0chz/why_i_like_vti_or_voo_but_not_vxus/kvuuqg7/,"Yeah why you answering yourself, thats just embarrassing",1,ETFs
VXUS_sucks,kvigtiz,2024-03-19 08:50:18,/r/ETFs/comments/1bi0chz/why_i_like_vti_or_voo_but_not_vxus/kvigtiz/,"You make excellent points.  

What I dislike most about VXUS is the extra costs/taxes.  That means it has to outperform over the long-term just to stay even vs an ETF that is more efficient in that regard, like VTI or VOO.   I see that as being unlikely.  The tyranny of compounding costs is real.  

Of course I could be wrong, but I try and stack the odds as much in my favor as possible.  That’s really all an investor can do.",2,ETFs
BuckwheatDeAngelo,kvoy3wo,2024-03-20 13:10:15,/r/ETFs/comments/1bi0chz/why_i_like_vti_or_voo_but_not_vxus/kvoy3wo/,"I live in China (work for an MNC here), and the future is bright for the country despite short-term turbulence in the economy (most of the drag is coming from real estate).

Oddly though the country’s growth over the last decade or so hasn’t always been reflected in the stock market here. Historically people here have invested in real estate, and in my experience, they tend to view stock investing as a short term way to make money quickly. Although I’m sure there are some Chinese Bogleheads somewhere.",2,ETFs
VXUS_sucks,kviuy1n,2024-03-19 10:23:20,/r/ETFs/comments/1bi0chz/why_i_like_vti_or_voo_but_not_vxus/kviuy1n/,"I’m referring to investment results.   It’s true that the periods of outperformance are roughly 50/50 as far as time is concerned, but when exUS outperforms it does so by a smaller margin, and when the US outperforms it does so by a larger margin.  

Since 1926 US has outperformed by 2.3% annually.  This is a massive amount due to the effects of compounding.  

This is reflected in the chart:  https://postlmg.cc/rDBNR8zm

You can see that the shaded and unshaded areas are roughly equal, but the investment results are lopsided.",1,ETFs
VXUS_sucks,kvjj77e,2024-03-19 13:54:01,/r/ETFs/comments/1bi0chz/why_i_like_vti_or_voo_but_not_vxus/kvjj77e/,"You must have missed this chart.  https://postimg.cc/QBfXj9Q0

Business fundamentals have absolutely favored US companies.",-1,ETFs
bucsraysbolts69,kvln769,2024-03-20 00:45:04,/r/ETFs/comments/1bi0chz/why_i_like_vti_or_voo_but_not_vxus/kvln769/,I think a 100% Roman Empire portfolio would have been advisable.,2,ETFs
VXUS_sucks,kvhh6nq,2024-03-19 05:12:48,/r/ETFs/comments/1bi0chz/why_i_like_vti_or_voo_but_not_vxus/kvhh6nq/,Agree.  VT is also not tax-efficient since the foreign tax credit is lost because the fund holds less than 50% foreign stocks.,6,ETFs
MatterSignificant969,kvj6jbu,2024-03-19 11:50:30,/r/ETFs/comments/1bi0chz/why_i_like_vti_or_voo_but_not_vxus/kvj6jbu/,I don't really want to invest in China with the way their system is going. But India is the new China. So ...,2,ETFs
MatterSignificant969,kvi3r2n,2024-03-19 07:27:46,/r/ETFs/comments/1bi0chz/why_i_like_vti_or_voo_but_not_vxus/kvi3r2n/,Totally understand. I'd like to find a cheap way to invest internationally while avoiding China and the middle east for my international portfolio.,2,ETFs
andibrema,kvl4evy,2024-03-19 22:56:39,/r/ETFs/comments/1bi0chz/why_i_like_vti_or_voo_but_not_vxus/kvl4evy/,Apparently the mortality of man isn't priced in either,1,ETFs
Infamous-Potato-5310,kvhl51c,2024-03-19 05:35:22,/r/ETFs/comments/1bi0chz/why_i_like_vti_or_voo_but_not_vxus/kvhl51c/,"Trying to find specific stocks that will beat the S&P over 10 years is really hard.  So hard that most financial advisors can't do it.   If you're the type that likes to enjoy checking and fiddling with your portfolio a lot, read articles, etc then it might be worth the trouble.  I do, and I love NovoNordisk and their weight loss drugs as well.  The average retirement account holder probably doesnt even know what Novo Nordisk is.  Even those that do, a vast majority of people who invest in individual stocks would make more just buying VOO.",1,ETFs
VT_Sucks,kvhneaz,2024-03-19 05:48:30,/r/ETFs/comments/1bi0chz/why_i_like_vti_or_voo_but_not_vxus/kvhneaz/,"Nobody is saying there are not any good companies outside of the US.


TSM, Reliance Industries and Toyota are good companies.",-1,ETFs
VXUS_sucks,kvitbp6,2024-03-19 10:12:26,/r/ETFs/comments/1bi0chz/why_i_like_vti_or_voo_but_not_vxus/kvitbp6/,"I’m not sure why you keep mentioning emerging markets.  They make up a small percentage of VXUS.  

ExUS did outperform US during the decade 2000-2009, by 2.56% annually.  

https://postimg.cc/y3BC7pJd

While it’s not nothing, it’s not game-changing either, which is why it’s overwhelmed by the long-term results that include this period.  

Emerging markets have had a negative real rate of return for the last 16+ years with a CAGR of only 0.55%.  Imagine depending on such a fund during retirement.  

https://postimg.cc/sQFfkcs6",1,ETFs
qthistory,kvj4hsf,2024-03-19 11:33:50,/r/ETFs/comments/1bi0chz/why_i_like_vti_or_voo_but_not_vxus/kvj4hsf/,"If the US enters into a decades long crash, it absolutely will drag the rest of the world down with it.",1,ETFs
VT_Sucks,kvhvvpm,2024-03-19 06:39:22,/r/ETFs/comments/1bi0chz/why_i_like_vti_or_voo_but_not_vxus/kvhvvpm/,"Alright, you got a laugh out of me.",1,ETFs
fauxpolitik,kvihdp5,2024-03-19 08:53:55,/r/ETFs/comments/1bi0chz/why_i_like_vti_or_voo_but_not_vxus/kvihdp5/,Trump being president would be a major world crisis? Are you aware he was already president for 4 years and the stock market in fact did not crash during that time?,2,ETFs
VXUS_sucks,kvvl1g2,2024-03-21 20:09:34,/r/ETFs/comments/1bi0chz/why_i_like_vti_or_voo_but_not_vxus/kvvl1g2/,Bogleheads would have been much better off financially if they had followed his advice that international investing is completely unnecessary.,2,ETFs
None,kvi4i5i,2024-03-19 07:32:26,/r/ETFs/comments/1bi0chz/why_i_like_vti_or_voo_but_not_vxus/kvi4i5i/,I like VOO obviously but already have large VTI position.,2,ETFs
doomshallot,kvih88l,2024-03-19 08:52:56,/r/ETFs/comments/1bi0chz/why_i_like_vti_or_voo_but_not_vxus/kvih88l/,"Yeah I hear that. I consider the difference in cost minimal (something like only a few thousand dollars difference over a lifetime for a multi million dollar portfolio), but nonetheless it does suck. It bugs me a little, but I try to not think about it lol",1,ETFs
Nice_Item2093,kvoyet9,2024-03-20 13:13:27,/r/ETFs/comments/1bi0chz/why_i_like_vti_or_voo_but_not_vxus/kvoyet9/,Interesting!! Yeah we can see clearly too from their GDP Numbers but don’t see it reflected from their stock market. Could be diff from state owned businesses maybe? We know the Chinese market can be manipulated and luckin coffee www an example of that,1,ETFs
rao-blackwell-ized,kviwush,2024-03-19 10:36:44,/r/ETFs/comments/1bi0chz/why_i_like_vti_or_voo_but_not_vxus/kviwush/,"For about the 10th time, the practical comparison for the US investor is not US vs. ex-US, but rather US-only vs. global.

The imperfect correlations between markets are the entire point of diversification. That's why, for example, for the near-40-year period of 1970-2008, a global portfolio beat a US portfolio [on both a general and risk-adjusted basis](https://www.bogleheads.org/wiki/File:US-International.png).

Also, please stop suggesting that historical ""margins"" tell us what will happen in the future, or more broadly, that outcome bias should inform portfolio construction.",7,ETFs
cost0much,kvjq19k,2024-03-19 15:18:00,/r/ETFs/comments/1bi0chz/why_i_like_vti_or_voo_but_not_vxus/kvjq19k/,"Bruh that’s cause the most recent decades have benefited the US. And did you read any of the links I sent? Choosing a start date anytime before end of WW2 means that US automatically wins. But if you look at 1950-2020, you’d find ex-US to win by a large margin. Moreover, US just isn’t always dominant; from 1950-1970s, the US market plateaued and virtually had 0 growth. Imagine if a repeat of that happened from 2030-2050s: that would mean you’d literally earn nothing or perhaps lose money despite investing in the US stock market for 20+ years.",4,ETFs
rao-blackwell-ized,kvjlxrh,2024-03-19 14:26:43,/r/ETFs/comments/1bi0chz/why_i_like_vti_or_voo_but_not_vxus/kvjlxrh/,"You must have missed that US stocks' performance over roughly the past half-century has basically just been the expansion of price multiples, not an improvement in ""business fundamentals.""

That is, US companies did not generate more profit than ex-US companies; their stocks just got more expensive.

And remember what we know about expensiveness:  cheap stocks have greater expected returns, and expensive stocks have lower expected returns. We're still paying for a discounted sum of future cash flows at the end of the day. US stocks cannot get comparatively more expensive forever. 

Again, I'd highly encourage you to check your recency bias at the door when thinking about future allocations.",4,ETFs
VT_Sucks,kvhhvyg,2024-03-19 05:16:49,/r/ETFs/comments/1bi0chz/why_i_like_vti_or_voo_but_not_vxus/kvhhvyg/,"Real mystery to me since Vanguards lifestrategy funds qualify for being a fund of funds and are far older than VT. 


Guess they didn't feel like doing the same for VT. ",0,ETFs
alextheone42,kvhi03b,2024-03-19 05:17:30,/r/ETFs/comments/1bi0chz/why_i_like_vti_or_voo_but_not_vxus/kvhi03b/,What about VTI/VXUS for a 20 year olds ROTH IRA?,0,ETFs
Solid_Illustrator640,kvj6ruu,2024-03-19 11:52:28,/r/ETFs/comments/1bi0chz/why_i_like_vti_or_voo_but_not_vxus/kvj6ruu/,"Yeah, that could be something. I think sticking to the US is the way to go. Historically every other country sucks for investing lol. Except a few european markets.",1,ETFs
VT_Sucks,kvi599s,2024-03-19 07:37:10,/r/ETFs/comments/1bi0chz/why_i_like_vti_or_voo_but_not_vxus/kvi599s/,"There is FRDM which does just that for the Emerging Markets.


Although its got a ER of 0.49%",1,ETFs
RijnBrugge,kvhlkgh,2024-03-19 05:37:52,/r/ETFs/comments/1bi0chz/why_i_like_vti_or_voo_but_not_vxus/kvhlkgh/,"That’s why I hold the vast majority in broad etfs and then only buy single stocks I absolutely believe up to like 5-7% max of my portfolio. For me, atm, I am just convinced ASML has a patent on magic and will print money like nothing else in the next years. We‘ll see, as the market disagrees",5,ETFs
RijnBrugge,kvhnwiu,2024-03-19 05:51:27,/r/ETFs/comments/1bi0chz/why_i_like_vti_or_voo_but_not_vxus/kvhnwiu/,"Other good examples, yes. My point was rather ‚Europe has problems because Germany has expensive energy‘ is too reductionist. There’s also a bunch of booming economies in the Eastern EU. Some having a wonderful potential growth due to a mix of low population with high education levels little corruption and plenty resources (yay baltics). Some are like that but have real corruption issues that hem their potential (Bulgaria, I‘ll give RO a pass it’s getting better but yeah them too).",0,ETFs
rao-blackwell-ized,kviu4do,2024-03-19 10:17:51,/r/ETFs/comments/1bi0chz/why_i_like_vti_or_voo_but_not_vxus/kviu4do/,">I’m not sure why you keep mentioning emerging markets.  They make up a small percentage of VXUS.

You make it sound like VXUS is the only choice for international stocks. It isn't. I purposefully overweight EM with VWO.

I've already mentioned why several times - reliably lower correlation due to unique developmental risks, the ones you say should be avoided.

>While it’s not nothing, it’s not game-changing either

It certainly was for the person pulling the trigger on retirement during that period. My parents did. I saw it firsthand.

>Emerging markets have had a negative real rate of return for the last 16+ years with a CAGR of only 0.55%. Imagine depending on such a fund during retirement.

Emerging Markets just beat US stocks for the 2-decade period 2000-2019, so we can both cherrypick dates all day.

\--

Strangely (or maybe not so strange, depending on your perspective), Emerging Markets comprise:

* 85% of global population.
* 60% of global GDP.
* 10% of global stock market capitalization.
* Roughly 0% of most US portfolios.",4,ETFs
rao-blackwell-ized,kvj507c,2024-03-19 11:37:51,/r/ETFs/comments/1bi0chz/why_i_like_vti_or_voo_but_not_vxus/kvj507c/,">If the US enters into a decades long crash, it absolutely will drag the rest of the world down with it.

We ""absolutely"" don't know that with certainty. 

Again, see the famous Lost Decade 2000-2009: US down 10%, Developed Markets up 11%, Emerging Markets up 155%.

But that's also why I diversify with other asset classes anyway.",2,ETFs
Incredible__Lobster,kviaqwf,2024-03-19 08:11:44,/r/ETFs/comments/1bi0chz/why_i_like_vti_or_voo_but_not_vxus/kviaqwf/,Shed a light of wisdom regarding VNQ. What do you think?,1,ETFs
rao-blackwell-ized,kvxi86b,2024-03-22 02:57:25,/r/ETFs/comments/1bi0chz/why_i_like_vti_or_voo_but_not_vxus/kvxi86b/,"Again, stop using outcome bias as the entire basis of your anti-diversification argument.

Ironically, had he been able to do so cheaply, Bogle himself would have had greater general and risk-adjusted returns over his investing lifetime had he invested globally.",0,ETFs
VXUS_sucks,kvipfrz,2024-03-19 09:46:37,/r/ETFs/comments/1bi0chz/why_i_like_vti_or_voo_but_not_vxus/kvipfrz/,"I agree that the difference in expense ratios isn’t huge, but the differences in taxes is meaningful.   

For example, if VXUS is held in a retirement account the foreign tax credit is lost.  The credit varies slightly year to year but for VXUS it tends to be around 8.5% as shown here:  https://personal1.vanguard.com/pdf/FTC_2023.pdf

VXUS has a current dividend yield of 3.21% according to Morningstar:  https://www.morningstar.com/etfs/xnas/vxus/quote

The lost foreign tax credit therefore reduces returns by 27 basis points (8.5% x 321).  

For a $1 million dollar portfolio that translates to $2700 each year.  

That’s real money. 

And tax costs could be substantially higher than this in taxable accounts for high-income earners due to the high dividend yield and large percentage of non-qualified dividends in VXUS.   This is particularly true for high-income earners who live in states that also have high income taxes like CA, NY, NJ, and HI where the top rate is over 10%.  Those investors could be paying a 50% tax on their non-qualified dividends.  

Please check my math (haha), but I think this is correct.",4,ETFs
rao-blackwell-ized,kvjr5ln,2024-03-19 15:32:29,/r/ETFs/comments/1bi0chz/why_i_like_vti_or_voo_but_not_vxus/kvjr5ln/,"This guy seems to love cherrypicking dates to support his assertions, doesn't seem to understand why we'd prefer rolling returns, thinks the recent past tells us the future, and doesn't bother to look at or even address any evidence presented to him that refutes his demonstrably false statements that he presents as fact.

I suppose we should expect as much, as this is just one of his alt troll accounts. I probably shouldn't have wasted as much time as I did, but I figure novices probably lurk here so it's more for them.",4,ETFs
Max-63986,kvibcpb,2024-03-19 08:15:37,/r/ETFs/comments/1bi0chz/why_i_like_vti_or_voo_but_not_vxus/kvibcpb/,"Safe, but at your age you can be more aggressive. Of course it's not 100 certain but I have a feeling you'll underperform S&P500.",1,ETFs
VT_Sucks,kvhj5wl,2024-03-19 05:24:07,/r/ETFs/comments/1bi0chz/why_i_like_vti_or_voo_but_not_vxus/kvhj5wl/,Just VOO and DCA.,-2,ETFs
